PSA_Id,Domain,Class,English,Kiswahili,Ekegusii,Dholuo,Somali,Source,Date,Metadata
370,Agriculture,PSA,"Effective January 1, 2021, smallholder tea farmers under KTDA-managed factories will face a new Minimum Tax that reduces their income by over KShs 754 million annually.",,,,,https://kilimonews.co.ke/agriculture-policy/new-tax-to-affect-tea-farmers/,2026-07-14,scraped:Kilimo News - Policy
371,Agriculture,PSA,Youth farmers in agriculture face challenges accessing credit. Strategies to improve credit access are crucial for purchasing inputs and investing in agribusiness.,,,,,https://kilimonews.co.ke/agriculture-policy/factors-influencing-youth-access-to-credit-in-agriculture/,2026-07-14,scraped:Kilimo News - Policy
372,Agriculture,PSA,"The Tea Bill has been passed by the Senate, reintroducing the Tea Board. Stakeholders are advised to prepare for future consultations regarding the Bill's implementation.",,,,,https://kilimonews.co.ke/agriculture-policy/ktda-handed-final-blow-as-senate-passes-tea-bill/,2026-07-14,scraped:Kilimo News - Policy
373,Agriculture,PSA,"The Senate has rejected the Crops (Tea Industry) Regulations, 2020. Stakeholders in the tea industry should stay informed about any forthcoming regulations regarding county roles in agriculture.",,,,,https://kilimonews.co.ke/agriculture-policy/senate-committees-reject-tea-regulations-2020/,2026-07-14,scraped:Kilimo News - Policy
374,Agriculture,PSA,"Farmers and agribusiness stakeholders can soon benefit from the Warehouse Receipt System (WRS), allowing them to deposit commodities in certified warehouses and obtain receipts for financing.",,,,,https://kilimonews.co.ke/agriculture-policy/warehouse-receipt-system-wrs-takes-shape/,2026-07-14,scraped:Kilimo News - Policy
375,Agriculture,PSA,The Kenyan government has allocated Kshs 8 billion for maize meal subsidies to support farmers facing challenges.,,,,,https://kilimonews.co.ke/agriculture-policy/agriculture-ministry-under-fire-from-governors-and-senate/,2026-07-14,scraped:Kilimo News - Policy
376,Agriculture,PSA,Download the recently launched agriculture reforms bills essential for the sector from the Ministry of Agriculture's website.,,,,,https://kilimonews.co.ke/agriculture-policy/download-recently-launched-agriculture-reforms-bills-here/,2026-07-14,scraped:Kilimo News - Policy
377,Agriculture,PSA,Coffee factories can now register as autonomous societies under the Co-operative Societies Act. Millers and marketing agents are prohibited from lending to farmers; violations will be penalized.,,,,,https://kilimonews.co.ke/agriculture-policy/proposed-coffee-bill-2020-proposes-radical-changes-in-the-sector/,2026-07-14,scraped:Kilimo News - Policy
378,Agriculture,PSA,Farmers and stakeholders are invited to submit their views on five new agricultural reform bills within 21 days. Get involved to help shape the future of key crop value-chains.,,,,,https://kilimonews.co.ke/agriculture-policy/government-launches-5-agricultural-reform-bills/,2026-07-14,scraped:Kilimo News - Policy
379,Agriculture,PSA,The government will not interfere in the fertilizer market; dealers can plan based on a free market. Farmers are to benefit from affordable prices.,,,,,https://kilimonews.co.ke/agriculture-policy/the-government-will-not-deal-with-fertilizer-munya/,2026-07-14,scraped:Kilimo News - Policy
380,Agriculture,PSA,Tea-growing Counties are urged to stay informed on the ongoing legal dispute over proposed tea regulations as Governors challenge their implementation in court.,,,,,https://kilimonews.co.ke/agriculture-policy/governors-head-to-court-as-they-reject-the-proposed-tea-regulations/,2026-07-14,scraped:Kilimo News - Policy
381,Agriculture,PSA,Celebrate International Coffee Day on October 1st by supporting fair trade coffee and raising awareness of the challenges faced by coffee growers.,,,,,https://kilimonews.co.ke/agriculture-policy/the-weekly-coffee-dose-with-henry-kinyua-cooperative-debts/,2026-07-14,scraped:Kilimo News - Policy
382,Agriculture,PSA,"Over 200,000 households are benefiting from the 1 million kitchen gardens initiative. Households are encouraged to participate for fresh produce and a healthy diet.",,,,,https://kilimonews.co.ke/agriculture-policy/over-200000-households-benefit-from-the-ongoing-1-million-household-kitchen-gardens-initiative/,2026-07-14,scraped:Kilimo News - Policy
383,Agriculture,PSA,"By March 2021, all fishing vessels in Kenyan waters must land their catch at Kenyan Ports to avoid license revocation.",,,,,https://kilimonews.co.ke/agriculture-policy/president-kenyatta-unveils-measures-to-boost/,2026-07-14,scraped:Kilimo News - Policy
384,Agriculture,PSA,"Farmers are encouraged to engage with New KPCU for coffee milling, marketing, and warehousing services, as well as to access the Coffee Cherry Advance Revolving Fund.",,,,,https://kilimonews.co.ke/agriculture-policy/which-way-for-new-kpcu-the-chairman-talks/,2026-07-14,scraped:Kilimo News - Policy
385,Agriculture,PSA,Public participation is open for the new Warehouse Receipt System regulations. Farmers and stakeholders are urged to submit their views to ensure effective implementation.,,,,,https://kilimonews.co.ke/agriculture-policy/warehouse-receipt-system-regulations-released-for-public-participation/,2026-07-14,scraped:Kilimo News - Policy
386,Agriculture,PSA,The Kshs. 16.5 million Urum dam has been launched in Turkana to address water shortages. Communities are urged to participate in ensuring its effective use for peace and development.,,,,,https://kilimonews.co.ke/agriculture-policy/kshs-16-5m-urum-dam-launched-in-turkana-to-foster-peace/,2026-07-14,scraped:Kilimo News - Policy
387,Agriculture,PSA,Farmers and agribusiness stakeholders are urged to support the implementation of the African Continental Free Trade Area (AfCFTA) for improved trade and food security.,,,,,https://kilimonews.co.ke/agriculture-policy/concrete-steps-needed-to-implement-policy-reforms-for-africas-free-trade-area-fao-africa-regional-representative/,2026-07-14,scraped:Kilimo News - Policy
388,Agriculture,PSA,"Kenya will continue to import fish to address an annual deficit of 350,000 metric tonnes. Stakeholders are encouraged to invest in the aquaculture value chain to boost local production.",,,,,https://kilimonews.co.ke/agriculture-policy/kenya-to-continue-importing-fish-to-fill-deficit/,2026-07-14,scraped:Kilimo News - Policy
389,Agriculture,PSA,"Bamboo is now classified as a scheduled crop under the Crop Act, offering advantages such as reduced regulatory barriers and promoting private investment in agriculture.",,,,,https://kilimonews.co.ke/agriculture-policy/cabinet-endorses-bamboo-as-a-scheduled-crop/,2026-07-14,scraped:Kilimo News - Policy
390,Agriculture,PSA,The County Government of Nyandarua has launched a dairy value chain strategic plan to enhance the dairy sector. Farmers are encouraged to participate and maximize production.,,,,,https://kilimonews.co.ke/agriculture-policy/nyandarua-keen-to-revamp-the-dairy-sector-in-the-county/,2026-07-14,scraped:Kilimo News - Policy
391,Agriculture,PSA,The Country Agribusiness Partnership Framework (CAP-F) has been launched to enhance agribusiness partnerships and investments in Kenya. Stakeholders are encouraged to engage with this framework for improved collaboration.,,,,,https://kilimonews.co.ke/agriculture-policy/agribusiness-partnership-framework-launched-in-kenya/,2026-07-14,scraped:Kilimo News - Policy
392,Agriculture,PSA,"Farmers can now receive 50% of insurance premiums funded by the Government for crop losses, covering farms from ½ to 20 acres. Purchase your insurance to qualify.",,,,,https://kilimonews.co.ke/agriculture-policy/farmers-receive-kshs-117-5-million-compensation-for-crop-losses/,2026-07-14,scraped:Kilimo News - Policy
393,Agriculture,PSA,The Inter-sectoral Forum on Agrobiodiversity and Agroecology (ISFAA) is now launched to promote collaboration among stakeholders in biodiversity and agriculture. Engage with ISFAA for knowledge sharing and policy influence.,,,,,https://kilimonews.co.ke/agriculture-policy/inter-sectoral-forum-on-agrobiodiversity-and-agroecology-launched/,2026-07-14,scraped:Kilimo News - Policy
394,Agriculture,PSA,"All tea factories managed by KTDA must comply with new tea regulations by 31st March 2021 or face penalties, including license suspension or legal charges.",,,,,https://kilimonews.co.ke/agriculture-policy/comply-or-face-the-music-munya-warns-on-tea-regulations/,2026-07-14,scraped:Kilimo News - Policy
395,Agriculture,PSA,"The newly inaugurated Warehouse Receipt System Council will oversee the Warehouse Receipt System in Kenya, starting with coffee, tea, rice, beans, green grams, and wheat.",,,,,https://kilimonews.co.ke/agriculture-policy/warehouse-receipt-system-council-inaugurated-by-agriculture-cs-peter-munya/,2026-07-14,scraped:Kilimo News - Policy
396,Agriculture,PSA,Farmers are advised to maintain vigilance as the threat of desert locust re-infestation persists. Monitor for any signs of locust activity and report sightings immediately.,,,,,https://kilimonews.co.ke/agriculture-policy/kenya-beats-back-desert-locust-upsurge-for-now-but-east-africa-remains-at-risk/,2026-07-14,scraped:Kilimo News - Policy
397,Agriculture,PSA,"Due to the effects of Covid-19, farmers are encouraged to focus on drought-resistant crops like sorghum and millet for better resilience in production.",,,,,https://kilimonews.co.ke/agriculture-policy/here-is-the-state-of-agriculture-in-the-counties-cog-chairman-governor-oparanya/,2026-07-14,scraped:Kilimo News - Policy
398,Agriculture,PSA,Invest in basic infrastructure to enhance employment opportunities for rural youth. Ensure access to all-weather roads and food markets to support inclusive economic growth.,,,,,https://kilimonews.co.ke/general-news/basic-infrastructure-key-to-increased-employment-for-rural-youth-in-senegal/,2026-07-14,scraped:Kilimo News - Policy
399,Agriculture,PSA,Farmers in Northern Uganda can access the newly opened Regional Agricultural Mechanization Center in Agwata for irrigation and tractor maintenance services.,,,,,https://kilimonews.co.ke/agriculture-policy/uganda-building-5-regional-mechanization-centers/,2026-07-14,scraped:Kilimo News - Policy
400,Agriculture,PSA,Nakuru County is implementing a land rehabilitation program to restore degraded land and improve agricultural productivity. Farmers are encouraged to participate in soil management training and tree planting initiatives.,,,,,https://kilimonews.co.ke/agriculture-policy/land-rehabilitation-program-in-nakuru/,2026-07-14,scraped:Kilimo News - Policy
401,Agriculture,PSA,The High Court has halted the formation of the National Steering Committee on Tea Reforms; affected parties should stay updated on the ongoing legal proceedings.,,,,,https://kilimonews.co.ke/agriculture-policy/ktda-against-the-tea-reforms-steering-committee-by-munya/,2026-07-14,scraped:Kilimo News - Policy
402,Agriculture,PSA,"Farmers in Busia County can access free BT cotton seeds and should consider intercropping with legumes to optimize land use. For more information, contact the Busia County Department of Agriculture.",,,,,https://kilimonews.co.ke/agriculture-policy/bt-cotton-trial-in-the-country-looks-promising/,2026-07-14,scraped:Kilimo News - Policy
403,Agriculture,PSA,Farmers and food traders are urged to comply with municipal licensing and regulations to ensure food safety. This is vital to protect public health and sustain urban food security.,,,,,https://kilimonews.co.ke/agriculture-policy/unsafe-food-africas-silent-killer/,2026-07-14,scraped:Kilimo News - Policy
404,Agriculture,PSA,The government has approved the leasing of five state-owned sugar factories for at least 20 years to revitalize the sugar sector. Interested parties should prepare for engagement under the new leasing model.,,,,,https://kilimonews.co.ke/agriculture-policy/cabinet-approves-leasing-of-state-owned-sugar-factories/,2026-07-14,scraped:Kilimo News - Policy
405,Agriculture,PSA,"The new Finance Act zero rates VAT on maize, cassava, and wheat flour for 6 months, aiming to make unga more affordable for consumers.",,,,,https://kilimonews.co.ke/agriculture-policy/relief-as-amended-bill-zero-rates-vat-on-maize-wheat/,2026-07-14,scraped:Kilimo News - Policy
406,Agriculture,PSA,"The government is supplying 781,800 seedlings, including 40,000 cocoa seedlings, to farmers in 17 counties to promote food security and crop diversification.",,,,,https://kilimonews.co.ke/agriculture-policy/cocoa-introduced-in-kenya-as-government-supplies-various-seedlings-to-farmers/,2026-07-14,scraped:Kilimo News - Policy
407,Agriculture,PSA,The government has launched the One Million Kitchen Gardens Plan to support households in establishing kitchen gardens. Selected households will receive startup kits including seeds and a water tank.,,,,,https://kilimonews.co.ke/agriculture-policy/one-million-kitchen-gardens-plan-launched/,2026-07-14,scraped:Kilimo News - Policy
408,Agriculture,PSA,Aquaponics technology will be introduced in 35 counties to promote food security and nutrition. Farmers in these counties can anticipate training and support from county governments and the Ministry of Agriculture.,,,,,https://kilimonews.co.ke/agriculture-policy/aquaponics-to-be-rolled-out-in-35-counties/,2026-07-14,scraped:Kilimo News - Policy
409,Agriculture,PSA,The National Livestock Vaccination Program has been launched to combat animal diseases in Kenya. Farmers are encouraged to participate for the health and productivity of their livestock.,,,,,https://kilimonews.co.ke/agriculture-policy/national-livestock-vaccination-program-launched/,2026-07-14,scraped:Kilimo News - Policy
410,Agriculture,PSA,"The WFP is providing 1,050 modern beehives to 260 farmers in 11 counties to enhance beekeeping and boost honey production. Farmers are encouraged to engage in this lucrative industry.",,,,,https://kilimonews.co.ke/agriculture-policy/wfp-boosting-bee-keeping-in-11-counties/,2026-07-14,scraped:Kilimo News - Policy
411,Agriculture,PSA,All stakeholders in the fisheries sector are urged to adopt sustainable aquaculture practices and effective fisheries management to enhance food security and increase fish production by 2030.,,,,,https://kilimonews.co.ke/agriculture-policy/fisheries-management-works-so-its-time-to-apply-it-more-broadly/,2026-07-14,scraped:Kilimo News - Policy
412,Agriculture,PSA,Bungoma County has allocated significant resources to strengthen its agricultural sector. Farmers in the region should stay informed on upcoming opportunities and support initiatives.,,,,,https://kilimonews.co.ke/agriculture-policy/highlights-of-budget-allocations-in-the-agriculture-sector/,2026-07-14,scraped:Kilimo News - Policy
413,Agriculture,PSA,Coffee farmers can access up to 40% advance payment through the Kshs. 3 billion Coffee Advance Revolving Fund. Sign up for guarantee forms to qualify.,,,,,https://kilimonews.co.ke/agriculture-policy/ongoing-coffee-reforms-set-to-modernize-the-sector/,2026-07-14,scraped:Kilimo News - Policy
414,Agriculture,PSA,Farmers and agribusiness stakeholders are urged to prepare for impending food shortages as global supply chains face significant disruptions. Take action now to secure resources and plan accordingly.,,,,,https://kilimonews.co.ke/agriculture-policy/coronavirus-has-stress-tested-our-food-systems-and-many-are-set-to-fail/,2026-07-14,scraped:Kilimo News - Policy
415,Agriculture,PSA,"Farmers in Eastern Africa are urged to adopt resilient agricultural practices to combat the ongoing food crises, as over 27 million people face acute food insecurity in the region.",,,,,https://kilimonews.co.ke/agriculture-policy/overcoming-crises-building-resilience-the-way-to-feed-the-horn/,2026-07-14,scraped:Kilimo News - Policy
416,Agriculture,PSA,The government has launched the Shs 2.2bn Empowering Novel Agribusiness-led Employment (ENABLE Kenya) program aimed at boosting agribusiness opportunities and employment in the agriculture sector.,,,,,https://kilimonews.co.ke/agriculture-policy/president-uhurus-economic-stimulus-package-to-the-agriculture-sector/,2026-07-14,scraped:Kilimo News - Policy
417,Agriculture,PSA,The Kenyan government will no longer buy maize or farm inputs from farmers. Farmers can now use their produce as collateral for financing from financial organizations.,,,,,https://kilimonews.co.ke/agriculture-policy/kenyan-government-will-no-longer-buy-maize-from-farmers/,2026-07-14,scraped:Kilimo News - Policy
418,Agriculture,PSA,"Reforms at the National Cereals & Produce Board (NCPB) have begun, focusing on improving grain storage and stabilizing food supply. Stay informed for further updates on these changes.",,,,,https://kilimonews.co.ke/agriculture-policy/munya-starts-national-cereals-produce-board-reforms/,2026-07-14,scraped:Kilimo News - Policy
419,Agriculture,PSA,The Ministry of Agriculture will provide seedlings to farmers during the October to December rains. Farmers are encouraged to participate for improved crop production.,,,,,https://kilimonews.co.ke/agriculture-policy/agriculture-ministry-to-give-farmers-seedlings-to-help-them-face-challenges/,2026-07-14,scraped:Kilimo News - Policy
420,Agriculture,PSA,"Farmers in Uasin Gishu, Elgeyo Marakwet, Bomet, Nyandarua, Nyeri, and Taita Taveta can access 25 tons of free potato basic seed to produce certified seed.",,,,,https://kilimonews.co.ke/agriculture-policy/counties-receive-potato-basic-seed-to-produce-certified-seeds/,2026-07-14,scraped:Kilimo News - Policy
421,Agriculture,PSA,Seeds are essential commodities; unrestricted movement across borders is critical to prevent food insecurity. Stakeholders must advocate for this change immediately.,,,,,https://kilimonews.co.ke/agriculture-policy/restrictions-on-cross-border-movement-affecting-seed-supply-chain-comesa/,2026-07-14,scraped:Kilimo News - Policy
422,Agriculture,PSA,"Farmers are urged to review the proposed Crops (Tea Industry) Regulations 2020, which may negatively impact earnings and increase bureaucracy. Take action by voicing concerns before implementation.",,,,,https://kilimonews.co.ke/agriculture-policy/proposed-tea-regulations-will-strangle-farmers-ktda/,2026-07-14,scraped:Kilimo News - Policy
423,Agriculture,PSA,Farmers will not be able to sell maize directly to the government as the National Cereals and Produce Board shifts to a trading model. Needy individuals will receive cash transfers to purchase food.,,,,,https://kilimonews.co.ke/agriculture-policy/kenya-has-enough-food-despite-covid-19-pandemic-munya/,2026-07-14,scraped:Kilimo News - Policy
424,Agriculture,PSA,"The revised draft of tea regulations has been launched, proposing a complete overhaul of the Kenya Tea Development Authority (KTDA). All stakeholders in the tea sector should stay informed for upcoming changes.",,,,,https://kilimonews.co.ke/agriculture-policy/munya-ktda-abused-its-market-power/,2026-07-14,scraped:Kilimo News - Policy
425,Agriculture,PSA,The Ministry of Agriculture invites feedback on proposed tea sector reforms for 14 days. Submit written memorandums via the Ministry's and AFA's websites or call the provided hotline for clarifications.,,,,,https://kilimonews.co.ke/agriculture-policy/agriculture-cs-outlines-proposed-tea-sector-reforms/,2026-07-14,scraped:Kilimo News - Policy
426,Agriculture,PSA,Rwandan farmers and agricultural stakeholders are advised to enhance their desert locust preparedness following recent training from FAO. Stay informed on control operations and preventive measures.,,,,,https://kilimonews.co.ke/agriculture-policy/fao-boosts-rwandas-preparedness-for-a-potential-desert-locust-invasion/,2026-07-14,scraped:Kilimo News - Policy
427,Agriculture,PSA,The Ministry of Agriculture has developed guidelines to support the food supply chain during the COVID-19 pandemic. All stakeholders must adhere to these protocols for stability in food availability and accessibility.,,,,,https://kilimonews.co.ke/agriculture-policy/agriculture-ministry-proposes-guidelines-to-ensure-stability-in-the-food-supply-chain-during-covid-19-pandemic/,2026-07-14,scraped:Kilimo News - Policy
428,Agriculture,PSA,"Food supply is stable in Kenya. Farmers are advised to continue operations without panic buying, as transport of farm produce is unrestricted.",,,,,https://kilimonews.co.ke/agriculture-policy/munya-assures-of-enough-food-and-unrestricted-farm-produce-transport/,2026-07-14,scraped:Kilimo News - Policy
429,Agriculture,PSA,Farmers and agribusiness stakeholders are urged to ensure food supply chains remain uninterrupted during the COVID-19 pandemic to prevent potential food shortages.,,,,,https://kilimonews.co.ke/agriculture-policy/covid-19-let-food-flow-freely/,2026-07-14,scraped:Kilimo News - Policy
430,Agriculture,PSA,Farmers are urged to report any counterfeit or adulterated agro-inputs to local authorities to support Uganda's initiative in eliminating these harmful products.,,,,,https://kilimonews.co.ke/agriculture-policy/uganda-moves-to-eliminate-counterfeit-and-adulterated-agro-inputs/,2026-07-14,scraped:Kilimo News - Policy
431,Agriculture,PSA,Farmers in northern Uganda should remain vigilant as Desert Locust nymphs are hatching and may threaten food security. Report any sightings to local authorities immediately.,,,,,https://kilimonews.co.ke/agriculture-policy/locust-invasion-report-in-uganda/,2026-07-14,scraped:Kilimo News - Policy
432,Agriculture,PSA,"Farmers in Konyu and Karima wards, Nyeri County, can now register for e-voucher input subsidies; enumerators are being recruited for this initiative.",,,,,https://kilimonews.co.ke/agriculture-policy/nyeri-county-pilots-e-voucher-to-acquire-input-subsidies/,2026-07-14,scraped:Kilimo News - Policy
433,Agriculture,PSA,The Ministry of Agriculture is expanding rabies awareness and vaccination efforts to neighboring districts of Kassanda and Kyegegwa. Engage with local initiatives for vaccinations and education.,,,,,https://kilimonews.co.ke/agriculture-policy/increasing-awareness-about-rabies-in-uganda/,2026-07-14,scraped:Kilimo News - Policy
434,Agriculture,PSA,"Urgent humanitarian support is needed for 20,000 people facing extreme hunger in Akobo, Duk, and Ayod counties until April. Immediate action is required to address food insecurity in these areas.",,,,,https://kilimonews.co.ke/agriculture-policy/hunger-threatens-over-half-of-the-population-in-south-sudan/,2026-07-14,scraped:Kilimo News - Policy
435,Agriculture,PSA,Farmers in Kiambu County can access training on improved maize production techniques and early-maturing varieties through the Village-Based Advisors program.,,,,,https://kilimonews.co.ke/agriculture-policy/agra-partners-with-county-to-increase-maize-production/,2026-07-14,scraped:Kilimo News - Policy
436,Agriculture,PSA,"Farmers are encouraged to adopt nutrition-sensitive agricultural practices to improve food production, income, and women's empowerment in order to tackle malnutrition in their communities.",,,,,https://kilimonews.co.ke/agriculture-policy/zambia-working-towards-food-and-nutrition-security/,2026-07-14,scraped:Kilimo News - Policy
437,Agriculture,PSA,"Farmers in Uganda: The Ministry of Agriculture will support key commodities this season, including tea, fruits, livestock, and seeds. Engage with local agricultural offices for details on available resources.",,,,,https://kilimonews.co.ke/agriculture-policy/uganda-agriculture-minister-lays-out-plans-for-the-season/,2026-07-14,scraped:Kilimo News - Policy
438,Agriculture,PSA,The Kenya National Trading Corporation is buying excess rice from Kano Plains and Mwea Irrigation Schemes. Farmers are encouraged to sell their surplus to avoid post-harvest losses.,,,,,https://kilimonews.co.ke/agriculture-policy/we-are-buying-excess-rice-munya/,2026-07-14,scraped:Kilimo News - Policy
439,Agriculture,PSA,Smallholder tea farmers are urged to stay informed about potential changes in the Kenya Tea Development Agency as the President calls for its overhaul to enhance their welfare.,,,,,https://kilimonews.co.ke/agriculture-policy/ktda-finally-snared-by-the-president/,2026-07-14,scraped:Kilimo News - Policy
440,Agriculture,PSA,"Farmers in Kenya are warned of an imminent locust invasion, with swarms rapidly spreading across various counties. Take immediate action to protect crops and monitor developments.",,,,,https://kilimonews.co.ke/agriculture-policy/locusts-may-spread-further-warns-fao/,2026-07-14,scraped:Kilimo News - Policy
441,Agriculture,PSA,The new board of the Kenya Planters Cooperative Union is operational and will manage the Coffee Cherry Advance Revolving Fund to support Kenyan coffee farmers.,,,,,https://kilimonews.co.ke/agriculture-policy/new-kpcu-board-officially-inaugurated/,2026-07-14,scraped:Kilimo News - Policy
442,Agriculture,PSA,"The Kshs. 3 Billion Cherry Advance Revolving Fund regulations have been approved. Coffee stakeholders are invited to submit written feedback by January 15, 2020.",,,,,https://kilimonews.co.ke/agriculture-policy/kenyan-cabinet-approves-kshs-3-billion-cherry-advance-revolving-fund-regulations-to-boost-coffee/,2026-07-14,scraped:Kilimo News - Policy
443,Agriculture,PSA,Attention youth in agriculture: Engage with FAO's Hand-in-Hand initiative to access resources and support aimed at achieving food security and Sustainable Development Goal 2.,,,,,https://kilimonews.co.ke/agriculture-policy/need-to-harness-youths-potential-to-end-hunger-fao/,2026-07-14,scraped:Kilimo News - Policy
444,Agriculture,PSA,"All livestock in Kenya must be registered under new proposed regulations, requiring identification devices for each animal before entering slaughterhouses.",,,,,https://kilimonews.co.ke/agriculture-policy/all-livestock-in-kenya-to-be-registered-under-new-proposed-regulations/,2026-07-14,scraped:Kilimo News - Policy
