PSA_Id,Domain,Class,English,Kiswahili,Ekegusii,Dholuo,Somali,Source,Date,Metadata
1,Agriculture,PSA,Farmers are urged to prioritize safe agrochemical usage as Kenya hosts the World Farmers' Organisation General Assembly.,,,,,https://kilimo.go.ke/cs-kagwe-calls-for-global-action-on-hazardous-agrochemicals-as-kenya-hosts-world-farmers-organisation-general-assembly/,2026-07-14,scraped:MoALD News
2,Agriculture,PSA,Trucks ferrying top-dressing fertilizer are now arriving at the Eldoret Depot of the National Cereals and Produce Board. Farmers are encouraged to collect their supplies.,,,,,https://kilimo.go.ke/trucks-ferrying-top-dressing-fertilizer-have-begun-arriving-at-the-eldoret-depot-of-the-national-cereals-and-produce-boa/,2026-07-14,scraped:MoALD News
3,Agriculture,PSA,Farmers in Wajir are invited to participate in the Ksh. 5 billion Livestock Investment Drive launched by President Ruto.,,,,,https://kilimo.go.ke/president-ruto-launches-ksh-5b-livestock-investment-drive-in-wajir/,2026-07-14,scraped:MoALD News
4,Agriculture,PSA,Farmers are encouraged to participate in the sugarcane ethanol initiative to help lower fuel prices and boost the sugar sector.,,,,,https://kilimo.go.ke/kenya-turns-to-sugarcane-ethanol-to-lower-fuel-prices-expand-sugar-sector/,2026-07-14,scraped:MoALD News
5,Agriculture,PSA,"A Ksh. 34.4 billion program has been launched to enhance climate resilience, food security, and sustainable livelihoods. Stakeholders in agriculture are encouraged to participate.",,,,,https://kilimo.go.ke/government-ifad-and-counties-unite-in-ksh-34-4-billion-programme-to-advance-climate-resilience-food-security-and-sustainable-livelihoods/,2026-07-14,scraped:MoALD News
6,Agriculture,PSA,The 12th Agritec Africa Conference will be held at KICC. Farmers and agribusiness stakeholders are encouraged to participate.,,,,,https://kilimo.go.ke/ps-agriculture-leads-curtain-raiser-for-12th-agritec-africa-conference-ahead-of-kicc-summit/,2026-07-14,scraped:MoALD News
7,Agriculture,PSA,The 4th National Kalro Open Research Week and 20th Annual Ruiru Coffee Fair is now open. Farmers and stakeholders in the coffee industry are encouraged to participate.,,,,,https://kilimo.go.ke/ps-for-agriculture-dr-kipronoh-ronoh-paul-cbs-officially-opens-4th-national-kalro-open-research-week-and-20th-annual-ruiru-coffee-fair/,2026-07-14,scraped:MoALD News
8,Agriculture,PSA,Farmers in Garissa are encouraged to utilize the Bulla Cadey Irrigation Scheme to enhance agricultural productivity.,,,,,https://kilimo.go.ke/ps-agriculture-and-cs-water-commission-bulla-cadey-irrigation-scheme-in-garissa/,2026-07-14,scraped:MoALD News
9,Agriculture,PSA,"The High Court has dismissed a petition against the Nzoia Sugar lease, allowing West Kenya Sugar to proceed with its Ksh 5.7 billion investment.",,,,,https://kilimo.go.ke/rulling/,2026-07-14,scraped:MoALD News
10,Agriculture,PSA,The Kenya Sugar Board announces that no sugar factories have been sold; they are only leased. Stakeholders should verify their contracts accordingly.,,,,,https://kilimo.go.ke/no-sugar-factory-sold-only-leased-agriculture-livestock-development-cs-tells-parliament/,2026-07-14,scraped:MoALD News
11,Agriculture,PSA,The Kenyan government has partnered with Pula Advisors to offer an innovative insurance program aimed at boosting climate resilience for smallholder farmers.,,,,,https://kilimo.go.ke/kenya-partners-with-pula-advisors-to-boost-climate-resilience-for-smallholder-farmers-through-innovative-insurance-program/,2026-07-14,scraped:MoALD News
12,Agriculture,PSA,Farmers and agribusiness stakeholders are encouraged to participate in new opportunities under the Bottom-Up Economic Transformation Agenda (BETA) for agricultural reforms and sugar sector revitalization.,,,,,https://kilimo.go.ke/cs-mutahi-kagwe-briefs-rt-hon-raila-odinga-on-agricultural-reforms-sugar-sector-revitalization-under-beta-agenda/,2026-07-14,scraped:MoALD News
13,Agriculture,PSA,A partnership has been formed to address climate challenges in East African agriculture. Farmers are encouraged to stay informed about upcoming initiatives and resources.,,,,,https://kilimo.go.ke/cs-sen-mutahi-kagwe-kilimo-trust-ceo-dr-birungi-korutaro-forge-partnership-to-tackle-climate-challenges-in-east-african-agriculture/,2026-07-14,scraped:MoALD News
14,Agriculture,PSA,The government has waived packaging taxes to support the tea sector. Farmers are encouraged to take advantage of this initiative.,,,,,https://kilimo.go.ke/government-waives-packaging-taxes-to-boost-tea-sector-cs-mutahi-kagwe-reaffirms-support-for-farmers/,2026-07-14,scraped:MoALD News
15,Agriculture,PSA,The World Bank is collaborating with the Ministry of Agriculture to advance the Digital Agriculture Roadmap. Stay informed for updates on program opportunities.,,,,,https://kilimo.go.ke/world-bank-pays-courtesy-call-to-cabinet-secretary-ministry-of-agriculture-to-advance-digital-agriculture-roadmap/,2026-07-14,scraped:MoALD News
16,Agriculture,PSA,There is ongoing collaboration between the PS for Agriculture and the World Bank Group regarding Kenya's Digital Agriculture Roadmap. Stay informed for upcoming initiatives.,,,,,https://kilimo.go.ke/ps-for-agriculture-dr-ronoh-hosts-world-bank-group-for-talks-on-kenyas-digital-agriculture-roadmap/,2026-07-14,scraped:MoALD News
17,Agriculture,PSA,The Rockefeller Foundation is partnering with Kenya to enhance food security and promote agricultural innovation. Farmers and agribusiness stakeholders should stay updated on new initiatives.,,,,,https://kilimo.go.ke/kenya-and-rockefeller-foundation-forge-strategic-alliance-to-boost-food-security-and-agricultural-innovation/,2026-07-14,scraped:MoALD News
18,Agriculture,PSA,Farmers are assured of uninterrupted fertilizer supply from the Thika NCPB Depot.,,,,,https://kilimo.go.ke/secretary-administration-visits-thika-ncpb-depot-assures-farmers-of-uninterrupted-fertilizer-supply/,2026-07-14,scraped:MoALD News
19,Agriculture,PSA,There are ongoing assessments in Kenya's tea sector. Stakeholders in the tea industry are encouraged to stay informed about developments and implement any necessary adjustments to improve productivity.,,,,,https://kilimo.go.ke/cs-mutahi-kagwe-assesses-progress-in-kenyas-tea-sector-at-chai-trading-warehouses/,2026-07-14,scraped:MoALD News
20,Agriculture,PSA,The export ban on macadamia remains in effect. Farmers are advised to stay updated on any future changes regarding this policy.,,,,,https://kilimo.go.ke/cs-mutahi-kagwe-defends-macadamia-export-ban-highlights-progress-in-tea-sector-reform/,2026-07-14,scraped:MoALD News
21,Agriculture,PSA,The 8th Africa Agric Expo 2025 is officially open at KICC. Farmers and agribusiness stakeholders are encouraged to attend and explore opportunities.,,,,,https://kilimo.go.ke/principal-secretary-dr-kipronoh-ronoh-presides-over-the-official-opening-of-the-8th-africa-agric-expo-2025-at-kicc/,2026-07-14,scraped:MoALD News
22,Agriculture,PSA,There are new agricultural partnerships under discussion that may benefit Kenyan farmers. Stay informed about developments and opportunities related to these initiatives.,,,,,https://kilimo.go.ke/strengthening-agricultural-partnerships-cs-mutahi-kagwe-meets-with-ifad-president-on-the-sidelines-of-the-48th-ifad-governing-council-in-rome-italy-%f0%9f%87%b0%f0%9f%87%aa%f0%9f%87%ae%f0%9f%87%b9/,2026-07-14,scraped:MoALD News
23,Agriculture,PSA,Farmers and agribusiness stakeholders in the tea sector are encouraged to engage with Dr. Kipronoh Ronoh to discuss strategies for strengthening the sector and boosting earnings.,,,,,https://kilimo.go.ke/ps-dr-kipronoh-ronoh-engages-stakeholders-to-strengthen-tea-sector-and-boost-farmer-earnings/,2026-07-14,scraped:MoALD News
24,Agriculture,PSA,No actionable information available.,,,,,https://kilimo.go.ke/cs-kagwe-holds-first-meeting-with-departmental-heads-at-the-ministry-of-agriculture-and-livestock-development/,2026-07-14,scraped:MoALD News
25,Agriculture,PSA,Kenya is set to enhance cotton production and the textile industry. Farmers and stakeholders should prepare for upcoming initiatives.,,,,,https://kilimo.go.ke/kenya-to-boost-cotton-production-and-textile-industry-following-insights-from-benin-visit/,2026-07-14,scraped:MoALD News
26,Agriculture,PSA,Farmers in Kericho: The Principal Secretary of Agriculture visited the Tebesonik Tea Factory and Charera Water Project to address your concerns and promote sustainable development.,,,,,https://kilimo.go.ke/dr-kipronoh-ronoh-paul-principal-secretary-of-agriculture-visits-tebesonik-tea-factory-and-charera-water-project-in-kericho-to-address-farmers-concerns-and-promote-sustainable-development/,2026-07-14,scraped:MoALD News
27,Agriculture,PSA,Farmers in Naivasha are advised to check the NCPB store for updates on the fertilizer subsidy distribution.,,,,,https://kilimo.go.ke/the-ps-dr-kipronoh-ronoh-paulcbs-visits-naivasha-ncpb-store-to-assess-fertilizer-subsidy-distribution-progress/,2026-07-14,scraped:MoALD News
28,Agriculture,PSA,The sugar sector is a vital economic pillar and source of livelihood for millions in western Kenya.,,,,,https://kilimo.go.ke/the-sugar-sector-remains-a-key-economic-pillar-and-a-livelihood-source-for-millions-especially-in-western-kenya/,2026-07-14,scraped:MoALD News
29,Agriculture,PSA,Farmers in Uasin Gishu are encouraged to participate in National Farmers' Day celebrations aimed at highlighting agricultural transformation.,,,,,https://kilimo.go.ke/ps-dr-kipronoh-ronoh-leads-national-farmers-day-celebrations-in-uasin-gishu-to-highlight-agricultural-transformation/,2026-07-14,scraped:MoALD News
30,Agriculture,PSA,"The Narok and Bomet Counties Agripreneurs Model initiative is now available under NAVCDP. Interested agripreneurs should take note and participate starting December 18, 2024.",,,,,https://kilimo.go.ke/ps-dr-kipronoh-ronoh-paulcbs-presides-over-the-unveiling-of-the-narok-and-bomet-counties-agripreneurs-model-a-transformative-initiative-under-navcdp/,2026-07-14,scraped:MoALD News
31,Agriculture,PSA,"The 2025 Long Rains National Fertilizer Subsidy Programme is now launched; farmers are encouraged to apply for subsidies at NCPB GPC Depot, Nairobi.",,,,,https://kilimo.go.ke/cs-dr-andrew-karanja-has-presided-over-the-launch-of-the-2025-long-rains-national-fertilizer-subsidy-programme-nfsp-at-the-ncpb-gpc-depot-nairobi/,2026-07-14,scraped:MoALD News
32,Agriculture,PSA,"1 million bags of subsidized fertilizers are now available for farmers. Please visit your local agricultural office to obtain your supply starting December 18, 2024.",,,,,https://kilimo.go.ke/the-principal-secretary-state-department-for-agriculture-dr-kipronoh-ronoh-paulcbs-flags-off-the-first-batch-of-1million-bags-of-subsidized-fertilizers/,2026-07-14,scraped:MoALD News
33,Agriculture,PSA,"The Kimalel Goat Auction will take place on December 17, 2024, to support the livestock sector. Farmers are encouraged to participate.",,,,,https://kilimo.go.ke/cs-dr-andrew-karanja-joins-h-e-president-ruto-at-kimalel-goat-auction-to-boost-livestock-sector/,2026-07-14,scraped:MoALD News
34,Agriculture,PSA,The National Agricultural Investment Plan is undergoing a review to align with global and national priorities. Stay informed for updates on how this may affect your agricultural activities.,,,,,https://kilimo.go.ke/cs-dr-andrew-karanja-launches-review-of-national-agricultural-investment-plan-to-align-with-global-and-national-priorities/,2026-07-14,scraped:MoALD News
35,Agriculture,PSA,"A groundbreaking ceremony for sustainable farming, education, and environmental restoration has been held in Murang'a. Farmers are encouraged to engage with local initiatives.",,,,,https://kilimo.go.ke/cs-dr-andrew-karanja-leads-groundbreaking-ceremony-in-muranga-championing-education-environmental-restoration-and-sustainable-farming/,2026-07-14,scraped:MoALD News
36,Agriculture,PSA,County leaders and stakeholders should prepare for upcoming discussions on agricultural advancement with the World Bank. Stay informed for details on participation opportunities.,,,,,https://kilimo.go.ke/cs-dr-andrew-karanja-leads-consultative-meeting-on-advancing-agriculture-with-county-leaders-and-world-bank/,2026-07-14,scraped:MoALD News
37,Agriculture,PSA,"Farmers and stakeholders are invited to engage in discussions on significant coffee reforms on December 6, 2024.",,,,,https://kilimo.go.ke/principal-secretary-state-department-for-agriculture-dr-kipronoh-ronoh-paul-engages-farmers-and-stakeholders-on-significant-coffee-reforms/,2026-07-14,scraped:MoALD News
38,Agriculture,PSA,Farmers are urged to remain vigilant and report any sightings of migratory pests or desert locusts to local agricultural authorities immediately.,,,,,https://kilimo.go.ke/regional-agriculture-ministers-gather-in-mombasa-to-address-threat-of-migratory-pests-and-desert-locust/,2026-07-14,scraped:MoALD News
39,Agriculture,PSA,The Ministry of Agriculture and Livestock Development has launched the Farmer Registration Report 2023. Farmers are encouraged to access the report for vital information.,,,,,https://kilimo.go.ke/8863-2/,2026-07-14,scraped:MoALD News
40,Agriculture,PSA,No actionable information for farmers or agribusiness stakeholders is present in this article.,,,,,https://kilimo.go.ke/courtesy-call-by-the-agricultural-society-of-kenya-delegation-to-the-cs-for-agriculture-and-livestock-development-dr-andrew-karanja/,2026-07-14,scraped:MoALD News
41,Agriculture,PSA,"Kenyan farmers are encouraged to engage in partnerships that strengthen the agricultural sector. For details, contact your local agricultural office.",,,,,https://kilimo.go.ke/cs-dr-andrew-karanja-and-agra-president-dr-agnes-kalibata-discuss-strengthening-kenyas-agricultural-sector-through-strategic-partnerships/,2026-07-14,scraped:MoALD News
42,Agriculture,PSA,"Youth interested in agribusiness can participate in the TEJATI initiative aimed at transforming agricultural ecosystems through technology and innovation. Sign up by November 29, 2024.",,,,,https://kilimo.go.ke/empowerment-for-youths-in-agribusiness-through-transforming-ecosystems-for-jobs-in-agriculture-through-technology-and-innovation-tejati-initiative/,2026-07-14,scraped:MoALD News
43,Agriculture,PSA,Caritas Nairobi has unveiled its Strategic Plan for 2024 to enhance agricultural empowerment. Stakeholders in agriculture are encouraged to engage with this initiative.,,,,,https://kilimo.go.ke/caritas-nairobi-unveils-strategic-plan-2024-with-cs-dr-andrew-karanja-advancing-agricultural-empowerment-and-community-transformation/,2026-07-14,scraped:MoALD News
44,Agriculture,PSA,The Ministry of Agriculture and Livestock Development has launched the National Agroecology Strategy for Food Systems Transformation. All stakeholders are encouraged to familiarize themselves with the strategy.,,,,,https://kilimo.go.ke/ministry-of-agriculture-and-livestock-development-officially-launch-its-national-agroecology-strategy-for-food-systems-transformation/,2026-07-14,scraped:MoALD News
45,Agriculture,PSA,Farmers are urged to access certified and quality seeds to revitalize the agriculture sector. Check with local agricultural offices for availability and support.,,,,,https://kilimo.go.ke/revitalizing-the-agriculture-sector-through-provision-of-certified-and-quality-seeds-to-our-farmers/,2026-07-14,scraped:MoALD News
46,Agriculture,PSA,Farmers are encouraged to take advantage of subsidized fertilizer and high-quality seeds to boost production.,,,,,https://kilimo.go.ke/government-supports-farmers-in-increasing-their-production-through-provision-of-subsidized-fertilizer/,2026-07-14,scraped:MoALD News
47,Agriculture,PSA,The Kenya Agricultural Management Information System (KIAMIS) is being scaled up for a digitized and transparent agricultural sector. Stay informed on updates and usage.,,,,,https://kilimo.go.ke/cs-dr-andrew-karanja-leads-efforts-to-scale-up-kiamis-for-a-digitized-and-transparent-agricultural-sector/,2026-07-14,scraped:MoALD News
48,Agriculture,PSA,The Chemelil Sugar Strategic Plan 2023-2027 has been launched to transform the sugar industry. Stakeholders should review the plan for future opportunities and participation.,,,,,https://kilimo.go.ke/cs-dr-andrew-karanja-launches-chemelil-sugar-strategic-plan-2023-2027-paving-the-way-for-industry-transformation/,2026-07-14,scraped:MoALD News
49,Agriculture,PSA,The government is supporting the sugar sector transformation to enhance value addition and increase production. Stakeholders are encouraged to engage in these initiatives.,,,,,https://kilimo.go.ke/driving-economic-growth-government-supports-sugar-sector-transformation-through-value-addition-and-increased-production/,2026-07-14,scraped:MoALD News
50,Agriculture,PSA,The government is enhancing support for the tea sector by focusing on value addition and quality production. Farmers are encouraged to adopt these practices for better profitability.,,,,,https://kilimo.go.ke/government-reaffirms-commitment-to-boosting-tea-sector-through-value-addition-and-quality-production/,2026-07-14,scraped:MoALD News
51,Agriculture,PSA,The Avocado Society of Kenya is working with the government to address industry challenges; all avocado farmers are encouraged to engage for support and solutions.,,,,,https://kilimo.go.ke/cs-dr-andrew-karanja-meets-avocado-society-of-kenya-to-address-industry-challenges/,2026-07-14,scraped:MoALD News
52,Agriculture,PSA,No actionable content available.,,,,,https://kilimo.go.ke/ministry-of-agriculture-and-livestock-development-engages-senate-committee-to-advance-agricultural-growth/,2026-07-14,scraped:MoALD News
53,Agriculture,PSA,The EU and Kenya are collaborating to enhance sustainable agriculture driven by youth. Stay tuned for upcoming programs and opportunities to engage in this initiative.,,,,,https://kilimo.go.ke/strengthening-ties-eu-and-kenya-forge-pathways-to-a-sustainable-youth-driven-agriculture-sector/,2026-07-14,scraped:MoALD News
54,Agriculture,PSA,"The 12th STAK Congress has opened, focusing on the seed industry's vital role in Kenya's food security. Stakeholders in agriculture are encouraged to participate and engage in discussions.",,,,,https://kilimo.go.ke/director-of-crop-resource-management-leonard-kubok-opens-12th-stak-congress-emphasizes-seed-industrys-role-in-kenyas-food-security/,2026-07-14,scraped:MoALD News
55,Agriculture,PSA,The Sugar Bill has been signed to revitalize Kenya's sugar industry; farmers and stakeholders should stay informed on upcoming regulations and opportunities.,,,,,https://kilimo.go.ke/kenya-takes-monumental-step-in-revitalizing-sugar-industry-with-signing-of-the-sugar-bill/,2026-07-14,scraped:MoALD News
56,Agriculture,PSA,The government is advancing the dairy industry transformation under the BETA Plan. Milk processors are urged to align with the strategic goals outlined.,,,,,https://kilimo.go.ke/government-advances-dairy-industry-transformation-under-beta-plan-cs-dr-andrew-karanja-outlines-strategic-goals-with-milk-processors/,2026-07-14,scraped:MoALD News
57,Agriculture,PSA,The Intergovernmental Agriculture Forum is convening to drive strategic resolutions for agricultural sector transformation. Stakeholders are encouraged to participate and contribute.,,,,,https://kilimo.go.ke/cs-dr-andrew-karanja-and-cog-chair-hon-ahmed-abdullahi-lead-intergovernmental-agriculture-forum-to-drive-strategic-resolutions-for-sector-transformation/,2026-07-14,scraped:MoALD News
58,Agriculture,PSA,National and County Governments are enhancing collaboration for food security and agricultural growth. Stay informed on upcoming initiatives and support available for your farming activities.,,,,,https://kilimo.go.ke/national-and-county-governments-hold-consultative-meeting-to-enhance-collaboration-for-food-security-and-agricultural-growth/,2026-07-14,scraped:MoALD News
59,Agriculture,PSA,Farmers are advised to stay updated on the Fertilizer Subsidy Program and Food Security Preparedness Plan. Further details will be provided soon.,,,,,https://kilimo.go.ke/cs-dr-andrew-karanja-engages-world-bank-task-force-on-fertilizer-subsidy-program-and-food-security-preparedness-plan/,2026-07-14,scraped:MoALD News
60,Agriculture,PSA,Kenyan farmers are encouraged to engage with the Kenya-Denmark partnership to improve food safety and agricultural development.,,,,,https://kilimo.go.ke/cs-dr-andrew-karanja-and-danish-ambassador-strengthen-kenya-denmark-partnership-in-food-safety-and-agricultural-development/,2026-07-14,scraped:MoALD News
61,Agriculture,PSA,Farmers and agribusiness stakeholders are encouraged to utilize extension services to enhance agricultural transformation.,,,,,https://kilimo.go.ke/cs-dr-andrew-karanja-inaugurates-kefaas-symposium-emphasizes-the-importance-of-extension-services-for-agricultural-transformation/,2026-07-14,scraped:MoALD News
62,Agriculture,PSA,Farmers and agribusiness stakeholders are encouraged to explore new export opportunities as CS Dr. Andrew Karanja meets with AMCHAM Kenya to enhance U.S.-Kenya agricultural collaboration.,,,,,https://kilimo.go.ke/cs-dr-andrew-karanja-meets-amcham-kenya-taskforce-to-strengthen-u-s-kenya-agricultural-collaboration-and-boost-export-opportunities/,2026-07-14,scraped:MoALD News
63,Agriculture,PSA,"Farmers in Isiolo and Meru Counties are invited to participate in the Kenya Vision 2030 4th Medium Term Plan (MTP IV) dissemination Baraza on June 3, 2024.",,,,,https://kilimo.go.ke/agriculture-and-livestock-development-cs-hon-mithika-linturi-leads-the-kenya-vision-2030-4th-medium-term-plan-mtp-iv-dissemination-baraza-in-isiolo-and-meru-counties/,2026-07-14,scraped:MoALD News
64,Agriculture,PSA,Farmers are urged to prioritize soil health to improve agricultural productivity.,,,,,https://kilimo.go.ke/cs-mithika-linturi-emphasizes-soil-health-at-africa-fertilizer-and-soil-summit/,2026-07-14,scraped:MoALD News
65,Agriculture,PSA,Farmers and agribusiness stakeholders are encouraged to engage with the Agri-Preneurs Extension Model as discussed in the recent consultative workshop.,,,,,https://kilimo.go.ke/cs-mithika-linturi-presides-over-a-governors-consultative-workshop-on-the-agri-preneurs-extension-model-at-villa-rosa-kempinski-hotel-nairobi/,2026-07-14,scraped:MoALD News
66,Agriculture,PSA,"The Kenyan Fertilizer and Soil Health delegates forum is taking place at KALRO, Nairobi, on April 24, 2024. Farmers and agribusiness stakeholders are encouraged to attend.",,,,,https://kilimo.go.ke/ps-dr-kipronoh-ronoh-opens-the-kenyan-fertilizer-and-soil-health-delegates-forum-at-kalro-nairobi-ahead-of-the-upcoming-africa-fertilizer-and-soil-health-summit-afsh-that-will-take-place-from-may/,2026-07-14,scraped:MoALD News
67,Agriculture,PSA,Fertilizer e-vouchers for the Long Rain Season are now being distributed. Farmers are encouraged to collect their vouchers promptly to ensure timely access to fertilizers.,,,,,https://kilimo.go.ke/government-officials-and-stakeholders-collaborate-to-facilitate-smooth-distribution-of-fertilizer-e-vouchers-for-long-rain-season/,2026-07-14,scraped:MoALD News
68,Agriculture,PSA,The Government has launched the Safe Milk Kenya Campaign to boost growth and competitiveness in the dairy sector. Farmers are encouraged to participate for improved standards.,,,,,https://kilimo.go.ke/government-spearheads-safe-milk-kenya-campaign-to-enhance-dairy-sector-growth-and-competitiveness/,2026-07-14,scraped:MoALD News
69,Agriculture,PSA,Hungary has established a demo farm in Kirinyaga County to showcase Hungarian agricultural technology. Farmers and agribusiness stakeholders are encouraged to visit and learn.,,,,,https://kilimo.go.ke/5813-2/,2026-07-14,scraped:MoALD News
70,Agriculture,PSA,"Farmers in Meru County can now access a new mobile grain dryer, receive sunflower seeds, and utilize the newly inaugurated aflatoxin testing lab for enhanced agricultural support.",,,,,https://kilimo.go.ke/cs-mithika-linturi-enhances-agricultural-support-in-meru-county-unveils-mobile-grain-dryer-distributes-sunflower-seeds-and-inaugurates-aflatoxin-testing-lab/,2026-07-14,scraped:MoALD News
71,Agriculture,PSA,The government is providing solar mobile grain dryers and subsidized fertilizer to enhance agriculture and food security. Farmers are encouraged to take advantage of these resources.,,,,,https://kilimo.go.ke/cs-mithika-linturi-unveils-solar-mobile-grain-dryers-and-subsidized-fertilizer-to-boost-agriculture-and-food-security-in-nakuru-county/,2026-07-14,scraped:MoALD News
72,Agriculture,PSA,"A duty waiver for sugar, rice, and maize imports is under consideration. Affected stakeholders should monitor updates for further information and requirements.",,,,,https://kilimo.go.ke/cs-mithika-linturi-addresses-national-assembly-committee-on-duty-waiver-for-sugar-rice-and-maize-imports/,2026-07-14,scraped:MoALD News
73,Agriculture,PSA,The Murang'a County government has launched a pilot digital system for the distribution of agricultural inputs. Farmers in the area are encouraged to participate.,,,,,https://kilimonews.co.ke/science-and-technology/,2026-07-14,scraped:Kilimo News - Agribusiness
74,Agriculture,PSA,Bungoma County is enhancing its agricultural sector; farmers are encouraged to participate in new initiatives for improved farming practices.,,,,,https://kilimonews.co.ke/advertisement/to-advertise-here-call-0722560238/,2026-07-14,scraped:Kilimo News - Agribusiness
75,Agriculture,PSA,Young entrepreneurs in agriculture are facing barriers beyond just access to finance. Stakeholders are urged to provide targeted investment and support to help youth-led agribusinesses thrive.,,,,,https://kilimonews.co.ke/agribusiness/faith-kwambokas-journey-shows-why-youth-need-more-than-capital-to-transform-agriculture/,2026-07-14,scraped:Kilimo News - Agribusiness
