Category,English
health,"""Trusted local voices make communities more willing to listen, adopt preventive practices and seek treatment early,"" said Mrs Hannatu Bello of NCDC's Risk Communication team."
health,"Public Health Specialist, Ministry of Health, Burkina Faso Dr Nare has played a central role in strengthening Burkina Faso’s tobacco control landscape through comprehensive legislation and institutional reforms."
health,"Abdulrazaq is eligible for the new R21 malaria vaccine, which was introduced in Nigeria in 2024. “I am preparing Abdulrazaq to receive the malaria vaccination at the health facility."
health,Bayelsa and Kebbi States in Nigeria were prioritized for the introduction of the R21 malaria vaccine in 2024.
health,"Almost 569 000 children aged 5–21 months have received the first dose of the malaria vaccine as of March 2026, preventing illness and saving lives. “It is a great privilege and opportunity to reduce the spread of malaria,” she says. “We really appreciate it."
health,"With no reminders or announcements, her commitment alone drives her to ensure her child receives essential immunisation services. “My mother taught me that this is how you protect a child,” she says. “No distance is too far for that.” Her decision may be quiet, but its impact is significant."
health,"Over recent years, reports show that vaccination coverage has improved, with Penta 3 increasing from 33.7% to 53.3% (NDHS 2018; NDHS 2023–24), and a decline in vaccine preventable diseases such as measles and polio (SORMAS 2025)."
health,"For mothers like Amina, these changes were practical and immediate: the clinic opened as scheduled, vaccines were available, and health workers were present."
health,Pentavalent vaccine (Penta 3) coverage in Katsina is estimated at 53.3% according to the NDHS 2024 report—slightly below the national average of 53.4% and far short of the 90% target set under IA2030.
health,"Each percentage point represents thousands of children who remain at risk of preventable disease. “Vaccines are safe, effective and provided free of charge,” adds Hajiya Muhammad Sahura. “Families are encouraged to visit their nearest primary health centre for routine immunisation, even outside campaign periods."
health,Protection should not depend on chance.” Sustaining the promise The Government of Nigeria continues to prioritise routine immunisation and primary healthcare strengthening under the Nigeria Health Sector Renewal Investment Initiative (NHSRII) and the Sector Wide Approach (SWAp).
health,"Abuja, A disease surveillance officer in Sokoto State notices a rise in suspected cholera cases through a digital reporting system."
health,Strengthening public health institutions is essential to addressing Nigeria’s dual burden of infectious diseases and rising noncommunicable conditions.
health,"Nigeria continues to face challenges including disease outbreaks, maternal and child health gaps, climate-related health risks and rapid urban growth."
health,Digital tools will help health workers report cases faster and allow decision-makers to act quickly.
health,This helps ensure that data from communities informs policy and action.
health,"Sustained commitment coordinated action and continued investment from government, partners and communities will be needed to ensure these reforms translate into better health outcomes for all Nigerians."
health,"Evidence consistently shows that faster laboratory turnaround times enable quicker outbreak detection and response, reducing the spread and impact of infectious diseases."
health,"Three major improvements were commissioned on 27 April 2026: In Ibadan, on 30 April 2026, WHO supported the commissioning of a 100 kVA solar power system at the National Polio Laboratory, University College Hospital."
health,"We are grateful for WHO’s support.” How stronger laboratories protect families For Musa Bamaiyi Joseph, the difference is simple. “When we detect early, children do not suffer,” he said. “Now we can detect early.” Health workers across the north-east echo this."
health,"Bauchi, Data-driven, community-led vaccination is enabling children who have never received any vaccines (zero-dose) in Bauchi State to be reached, demonstrating how targeted action can close immunisation gaps at scale."
health,"Her decision reflects a wider shift across underserved communities, where integrated, primary health care–based vaccination is reaching children who have not received any routine vaccines."
health,"Investigations found that, despite previous measles–rubella campaigns, some children had missed routine vaccines because of caregiver hesitancy and limited access, leaving them vulnerable to preventable diseases."
health,"At least 13 local government areas, including Toro, Kirfi, Alkaleri, Ganjuwa, Shira and Ningi, have a high number of zero-dose children, with low pentavalent vaccine (Penta-3) coverage, which protects against five diseases, and many children miss follow-up doses."
health,"While overall state coverage is about 79%, nearly 45% LGAs remain below 80%, increasing the risk of vaccine preventable disease outbreaks."
health,"Now, more parents are bringing their children.” Bringing services closer To reduce access barriers, the state implemented an integrated delivery model combining routine immunisation for children aged 0–23 months, introduction of the malaria vaccine, and the Big Catch-Up targeting children aged 24–59 months."
health,"Across all 20 LGAs, 1,292 health workers were deployed to 323 wards during a four-day malaria vaccination intensification campaign from 24 to 28 March 2026."
health,"Awareness that drives uptake For Safiya Yakubu, a caregiver in Zango settlement, personal experience informed her decision to vaccinate her 15-month-old son. “I once had severe malaria and almost collapsed,” she said. “When I heard about the vaccine, I went straight to the health facility."
health,"Nigeria has one of the highest numbers of zero-dose children globally, with over 2.1 million children who have not received any routine vaccines, largely in hard-to-reach areas."
health,"Globally, an estimated 14.3 million children remain unvaccinated each year, sustaining outbreaks of vaccine-preventable diseases."
health,Sustaining and scaling this approach will be critical to reaching every child and ensuring equitable access to life-saving vaccines. • WHO Immunization Data Portal: https://immunizationdata.who.int • NPHCDA: https://nphcda.gov.ng
health,Our children can finally be taken care of.” Her words reflect the experience of many nomadic families across Nigeria who face barriers to routine immunization.
health,"These barriers leave children at high risk of measles and rubella, two highly contagious diseases that continue to cause outbreaks in the country."
health,"The team travelled by road and then on foot, carrying vaccine carriers, cold‑chain equipment, and materials to help families understand the importance of immunization."
health,Their goal was simple: find children who had missed routine vaccines and ensure no child was left behind.
health,"Fear, not refusal Halima Aliyu, a young mother, held her 12‑month‑old son as she spoke to the team. “I tried to take him for immunization once, but I was afraid they would reject me in the neighbouring village,” she said. “That fear made me stop trying.” Her son was one of two zero‑dose children vaccinated that day."
health,"According to Alhaja Oredeko, the Local Immunization Officer for Egbedore LGA, closing this gap requires more than vaccines. “Government primary health care facilities are open and free."
health,"Restoring confidence, strengthening systems For families like Mama Balkis’ and Halima’s, the visit brought more than vaccines."
health,Osun State’s experience shows that no settlement is too remote and no child too far away to be protected from vaccine‑preventable diseases.
health,Call to action Communities are encouraged to: Communications Officer WHO Nigeria Email: hammanyerok [at] who.int (hammanyerok[at]who[dot]int)
health,"Enugu; In Enugu State, families, health workers, and young volunteers are working together to protect children from measles, rubella, human papilloma virus (HPV), and other vaccine preventable diseases."
health,"Many children still miss routine vaccines, and outbreaks continue in areas with low coverage."
health,"Odoh Stella Chinasa from Auchima community, Idoha ward, Igbo Etiti LGA. “This time, I brought all my children to be vaccinated.” Reaching children everywhere To help ensure no child is missed, the state trained more than 60 National Youth Service Corps (NYSC) members as independent monitors."
health,"The monitors visit vaccination posts, schools, markets, health facilities, worship centres, and remote settlements."
health,"Beyond preventing disease, the campaign is helping the state prepare for the introduction of the MR vaccine into Nigeria’s routine immunization schedule."
health,"Adaeze Ugwu, WHO Enugu State Coordinator. “Every child deserves protection, no matter where they live.” Gavi funding supports vaccine procurement and operational needs, helping ensure vaccines reach communities across the state."
health,"Young Nigerians driving change For many NYSC members, the experience is personal. “I now understand how important vaccines are and why every child must be reached,” said Faith Bankole. “I am glad to support my community,” added Onyeani Emmanuel Atuh from Achara 1 in Enugu South LGA."
health,Call to action Parents and caregivers are encouraged to bring their children to the nearest vaccination post during the campaign.
health,"Meanwhile, for Ondo state, the Malaria vaccine will be introduced, displaying Government’s effort on campaign effectiveness."
health,"Other states, including Edo, Bayelsa, Lagos, Ekiti, and Ogun, used their flag-offs to mobilise traditional rulers, faith leaders, and community groups around a shared commitment that no child should be missed."
health,"When I heard, the vaccines were coming to our community, I knew I had to bring my grandchildren to receive the vaccine, and I am happy I did.” WHO’s technical support WHO is working closely with national and state authorities to strengthen planning, coordination, and monitoring."
health,"Abuja, Nigeria has launched its first nationally representative survey on antimicrobial resistance (AMR), marking a milestone in the country’s public health response."
health,"The Federal Ministry of Health and Social Welfare (FMoH&SW) and the Nigeria Centre for Disease Control and Prevention (NCDC), with technical support from WHO, recently concluded a five-day planning workshop."
health,"Nigeria’s efforts supported by WHO, NCDC, the National Agency for the Control of AIDS (NACA), and the Global Fund, demonstrate strong national ownership and multisectoral collaboration."
health,"Yola, In flood-prone Adamawa State, north-east Nigeria, early health preparedness helped protect thousands of vulnerable people from preventable disease outbreaks during the 2025 rainy season."
health,"The anticipatory response focused on preventing malaria, cholera and other flood-related diseases, while ensuring continuity of essential health services for displaced and vulnerable populations."
health,"Abuja, Nigeria, in collaboration with WHO and other partners, is intensifying efforts to eradicate all forms of polio by 2030 through government leadership, community engagement, and targeted vaccination campaigns."
health,"Hassana, who contracted the disease as a toddler, now uses a wheelchair and champions vaccination in her community."
health,"Community Engagement Across States Across Nigeria, WHO state offices joined government agencies, partners, and communities in commemorating World Polio Day, renewing advocacy for vaccination and stronger surveillance."
health,"A Future Without Polio For Hassana and other polio survivors, the fight against polio is deeply personal. “If I had been vaccinated, my life would be very different,” reflects Bukar Modu, a 45-year-old polio survivor. “But I can use my voice to make sure no other child suffers as I did."
health,The comprehensive Integrated Measles–Rubella and Polio Vaccination Campaign demonstrates strong government leadership and collaboration with local and international partners to ensure every eligible child receives essential vaccines.
health,"In recent weeks, health workers have traversed rivers, rugged terrain, and crowded settlements to protect children from vaccine-preventable diseases — including measles, rubella, and polio."
health,"Pavel Ursu, WHO Representative in Nigeria. “Reaching every eligible child today prevents outbreaks tomorrow."
health,"The Road Ahead As mop-up activities continue in areas with missed children, WHO, the Government of Nigeria, and partners urge all stakeholders — from community leaders to caregivers — to remain engaged and vigilant."
health,"The review became necessary as the previous version (2019) did not reflect the new WHO recommendations, evolving clinical evidence or available antiviral therapies."
health,"Participants included clinicians, infectious disease experts, IPC focal persons, epidemiologists, health educators, state health officials, and implementing partners from the most affected states."
health,"""Our priority is to ensure that mpox patients receive safe and timely care using evidence-based protocols,"" said Dr Odianosen Ehiakhamen, a participant from NCDC."
health,"""Updating Nigeria's mpox guidelines reflects Nigeria’s commitment to strengthening clinical preparedness and home-based care,"" said Dr Joshua Ofoli, WHO Case Management & IPC Technical Officer."
health,He said the updated guidelines will include referral mechanisms to improve home-based care and ensure safe referrals to health facilities if symptoms worsen.
health,"""The process also integrates digital reporting tools to improve surveillance, ensure timely data flow, and strengthen accountability across facility and community levels""."
health,"Collaborating with NCDC, WHO has trained 570 frontline health workers, distributed mpox IPC and triage tools, and launched community-based surveillance initiatives."
health,"Nigeria has set a unified national direction, and WHO will support implementation at federal and state levels” Koessan Kuawu, Deputy Representative of UNFPA Nigeria, emphasised the role of midwifery in lowering maternal deaths at the launch."
health,A coordinated path forward The NSDNM creates a framework to address workforce gaps and ensure sustainable investments in nursing and midwifery.
health,Nigeria is accelerating its efforts to eradicate AIDS as a public health threat by 2030.
health,"Bashorun, NASCP Coordinator. “We aim to ensure HIV prevention tools serve diverse populations and meet national goals.” Expanding Access and Choice Daily oral PrEP has been available in Nigeria since 2016, but uptake varies."
health,"If injectable PrEP can protect me, I’m ready to take it.” WHO advises providing a variety of PrEP options tailored to individual preferences and risk profiles as part of comprehensive HIV prevention."
health,Evidence indicates that long-acting injectable PrEP substantially lowers the risk of HIV acquisition and is particularly effective for those who struggle with daily adherence.
health,"Abuja, The Government of Nigeria has launched a nationwide integrated vaccination campaign targeting more than 106 million people across all 36 states and the Federal Capital Territory."
health,"The campaign delivers measles–rubella, polio vaccines, and HPV vaccination, to close immunity gaps and protect children and adolescents from life-threatening diseases."
health,"The campaign also delivers malaria chemoprevention (Seasonal Malaria Chemoprevention, SMC) for children aged 3–59 months, NTD treatments for persons aged 5 years and above, and HPV vaccines for girls aged 9 years."
health,"A Shared Vision for Health and Development In his remarks, Ambassador Tuggar emphasized that the COVID-19 pandemic served as a wake-up call for Nigeria, particularly in the area of vaccine operations."
health,"Ambassador Tuggar reflected on Nigeria’s longstanding engagement in health diplomacy, noting that in light of the COVID-19 pandemic and the evolving global landscape, we are witnessing “the return of new realism”—a moment that demands pragmatic, equity-driven partnerships and resilient health systems."
health,"Ursu is a physician who holds a Master of Science and a Postgraduate Diploma in Public Health from the London School of Hygiene and Tropical Medicine, a master’s degree in health services management, and a Diploma in High Impact Leadership from the University of Cambridge."
health,"We also developed Nigeria’s first National Suicide Prevention Strategic Framework, aligned with the Sustainable Development Goals on noncommunicable diseases and mental health."
health,"It specifically calls for a national suicide prevention strategy, which we have since developed, and guides our work on mental health governance."
health,Nigeria is among the few countries that still criminalize this act and we believe this must change.
health,It is now embedded within programmes on neglected tropical diseases and HIV and WHO’s Mental Health Gap Action Programme (mhGAP) 3.0 framework has been contextualized and endorsed by Nigeria’s National Council on Health.
health,So we pushed for the creation of mental health units within every state’s Department of Public Health.
health,We’ve worked to strengthen mental health and psychosocial support in these settings using the WHO mhGAP Humanitarian Intervention Guide.
health,Our goal is a more responsive and sustainable system that can be activated not only in humanitarian crises but also in epidemic and pandemic responses.
health,Our goal is universal health coverage that truly includes mental health – where people no longer must pay out of pocket for care.
health,"Currently, fewer than 3% of people with mental health conditions are covered by health insurance."
health,We’re also working to ensure mental health indicators are included in the National Health Management Information System and to build a data-driven approach to planning and service delivery.
health,"In addition to measles-rubella and polio vaccines, the campaign integrates routine immunization and other essential child health services, including treatment for neglected tropical diseases and seasonal malaria chemoprevention in high-risk areas."
health,I urge you to approach this campaign with the same resilience and commitment you have shown over the years.
health,"In preparation for this nationwide rollout, Nigeria has also strengthened systems to ensure smooth implementation."
health,"These investments will ensure that every health worker is supported and every child vaccinated is recorded accurately, bolstering accountability and trust in the programme."
health,"Measles is a highly contagious and potentially fatal disease, particularly for malnourished children, while rubella can cause severe birth defects (Congenital Rubella Syndrome) if contracted during pregnancy."
health,"Robust coordination mechanisms are in place for financing, social mobilization, training, vaccine delivery and logistics to ensure success."
health,"With technical support from the World Health Organization (WHO) and partners, the Government, through the National Emergency Operations Center (NEOC), has launched rapid surveillance assessments to enhance the capacity to detect suspected cases as rapidly as possible and guide vaccination responses."
health,"We will use these findings to close gaps and ensure no suspected case goes undetected.” For local health workers, the exercise strengthened their role in protecting communities. “I have seen children who suddenly lost strength in their legs."
health,"Now I know how important it is to report such cases quickly so they can get help,” said Salamatu Abubakar, a Village Health Worker at Danladi PHC, Sule Tankarkar LGA."
health,"Strengths and challenges While the RSA demonstrated strong structures, it also identified gaps requiring attention, including the need to expand active case searches, strengthen environmental surveillance, and address immunity gaps."
health,"With these lessons, we are better positioned to detect, report, and respond swiftly to any suspected cases.” National perspective and roadmap alignment Nigeria was certified free of wild poliovirus in 2020 but continues to face risks from circulating variant poliovirus type 2 (cVDPV2)."
health,"Surveillance remains central to the Polio Eradication Roadmap, and WHO is supporting Nigeria to ensure data-driven decisions and rapid vaccination responses."
health,"Dr Namadi Lawal, Technical Lead for Polio Surveillance at the National EOC, emphasized: “These assessments ensure Nigeria’s surveillance remains highly sensitive."
health,"During the flag-off, Zamfara State Commissioner, Dr Nafisa Muhammad Maradun, said, ""The vaccination initiative is part of a broader response to the outbreak, including activating the State Infectious Disease Hospital in Damba, distributing essential medication in affected LGAs, and strengthening disease surveillance."
health,"WHO and partners provided vaccines and technical support as part of the broader effort to contain the outbreak” Dr Raji Mukhtar, WHO Zamfara State Coordinator, emphasised, “The release of vaccines from the global stockpile reflects coordinated efforts to respond to the outbreak."
health,Remember our role is to support the government and ensure coordination.
health,"WHO has also donated essential medicines and supplies, including cholera kits, IV fluids, and diagnostic tools."
health,"Voices from the field Fatima Kabiru, who received the vaccine alongside her daughter, said, ""My neighbours fell sick, and we were worried."
health,"When I heard they were giving free cholera vaccines, I decided to tell my daughter, and together we took the vaccine to keep us safe."" A vaccinator, Aisha Mukhtar, said people's acceptance of the vaccine has been very impressive."
health,"We move from house to house vaccinating people and have not met anyone who rejected being vaccinated""."
health,"Abuja , To curb the spread of mpox, Nigeria launched a targeted vaccination campaign across 12 high-burden states, aiming to protect vulnerable populations and strengthen outbreak response mechanisms."
health,"Alex Gasasira, Acting WHO Representative in Nigeria, highlighted the milestone: ""The introduction of the mpox vaccine is a key step in stopping transmission and protecting frontline workers and vulnerable groups."
health,"As part of the efforts to curb transmission in Nigeria, the World Health Organization (WHO), in collaboration with the Benue State Ministry of Health and Human Services, has launched targeted sensitisation campaigns in 45 high-risk communities across five wards in Makurdi Local Government Area."
health,"WHO support strengthening communities’ response The intervention is being led by Benue State’s Public Health Emergency Operations Centre (PHEOC) and Lassa Fever Technical Working Groups (TWGs), with technical and logistical support from WHO."
health,"By bringing prevention messages to everyday spaces and training local health workers and volunteers, WHO is helping us build a community-led defense against the disease.” Dr Asma’i Zeenat, WHO North Central Zone Coordinator, emphasised: “Treatment is costly and mortality is high, but prevention is far more effective."
health,"His Royal Highness Clement Kulugh, Mue Ter Masev of Ugondo Community, commended the initiative: “People should share the message on precautions to prevent Lassa fever—store food properly, ensure hygienic practices, and tell others what they have learned."
health,"In the long term, WHO and the Benue State Ministry of Health will continue to scale up periodic sensitisation through community outreach and mass media, contributing to Nigeria’s national goal of reducing deaths from epidemic-prone diseases and building resilience against recurring outbreaks."
health,A field visit was held on 26 June 2026 in Eka Kotebe General Hospital and Yeka Woreda 9 health center in Addis Ababa to allow participants to observe and reflect on practical implementation in service delivery settings.
health,"Dr Abel Assefa, the Gambella Regional Health Bureau Head emphasized the urgency of the vaccination campaign, stating: “This synchronized effort is essential to protect our children, especially those in border and refugee communities who are most at risk."
health,"The Ethiopian Public Health Institute, working with WHO, UNICEF, and Global Polio Eradication Initiative partners, mobilized resources from the Gates Foundation, secured vaccine supplies, and strengthened logistics systems to support effective vaccination campaign delivery."
health,"WHO has played a programmatic leadership role in supporting the vaccination campaign implementation, providing financial support for operational costs, technical expertise for the planning, training, supervision, and monitoring."
health,"Health facilities, community informants, and frontline workers were urged to remain vigilant and report suspected cases promptly."
health,"The training, taking place in Hawassa from 29 June to 9 July 2026, brings together national experts, clinicians, academics and public health professionals across Ethiopia to strengthen the country's capacity to provide high-quality, lifesaving care for children affected by severe acute malnutrition."
