Category,English
health,"The WHO Hub for Pandemic and Epidemic Intelligence supports countries, regional and global actors to address future pandemic and epidemic risks with better access to data, better analytical capacities, and better tools and insights for decision-making."
health,Visit the Director's site Alliance for Primary Health Care in the Americas Better Care for NCDs Initiative Zero preventable maternal deaths Elimination Initiative
health,"When carried out using a method recommended by WHO appropriate to the pregnancy duration, and by someone with the necessary skills, abortion is a safe health care intervention (2)."
health,"In 2022, WHO published an updated, consolidated guideline on abortion care, including all WHO recommendations and best practice statements across three domains essential to the provision of abortion care: law and policy, clinical services and service delivery."
health,Global and regional causes of maternal deaths 2009-20: a WHO systematic analysis.
health,European Journal of Public Health 2018. https://www.ncbi.nlm.nih.gov/pubmed/29878101 (3) High prevalence of elder abuse during the COVID-19 pandemic: risk and resilience factors.
health,"Violence during adolescence also increases the risks of injury, HIV and other sexually transmitted infections, mental health problems, poor school performance and dropout, early pregnancy, reproductive health problems, and communicable and noncommunicable diseases."
health,Adolescent mental health fact sheet An estimated 1.7 million adolescents (age 10–19 years) were living with HIV in 2021 with around 90% in the WHO African Region.
health,"HIV facts in pictures Tuberculosis (TB) is a preventable and curable disease, but it continues to impact the lives and development of millions of children and adolescents."
health,The Global Tuberculosis Report shows that notification rates in adolescents aged 15–19 years are relatively high compared with younger adolescents.
health,"Tuberculosis fact sheet Other infectious diseases Diarrhoea and lower respiratory tract infections (pneumonia) are estimated to be among the top five causes of death for adolescents 10–14 years, with mortality rates being particularly high in African low- and middle-income countries."
health,Diarrhoeal disease fact sheet Early adolescence (9–14 years) is the optimal time for vaccination against HPV infection and it is estimated that if 90% of girls globally get the HPV vaccine more than 40 million lives could be saved over the next century.
health,Human papillomavirus (HPV) and cervical cancer fact sheet Overall there are proportionally fewer cases of and deaths from COVID-19 disease for adolescents and young adults than for older adults.
health,"However, the pandemic has severe indirect negative effects on young people’s well-being, including on their mental health, loss of education time through school closures, social isolation, physical inactivity, malnutrition and domestic violence."
health,"Adolescent pregnancy fact sheet Many of the main causes of mortality in adolescents and young adults have strong links to the environment, including unintentional injuries and infectious diseases."
health,Regular deworming in areas where intestinal helminths such as hookworm are common is recommended to prevent micronutrient (including iron) deficiencies.
health,"Malnutrition fact sheet Healthy diet fact sheet Globally, in 2016, only 1 in 5 adolescents are estimated to meet WHO guidelines on physical activity."
health,"To improve adolescent health measurement globally, WHO in collaboration with UNAIDS, UNESCO, UNFAP, UNICEF, UN Women, the World Bank Group, and the World Food Programme (WFP), has established the Global Action for Measurement of Adolescent health (GAMA) Advisory Group ."
health,There is growing attention being paid to improving access to quality maternal care for pregnant and parenting adolescents.
health,"WHO works with partners to advocate for attention to adolescent pregnancy, to build an evidence base for action, to develop policy and programme support tools, to build capacity and to support countries to address adolescent pregnancy effectively."
health,"Even within countries, there are enormous variations, for example in Zambia the percentage of adolescent girls aged 15–19 who have begun childbearing (women who either have had a birth or are pregnant at the time of interview) ranged from 14.9% in Lusaka to 42.5% in the Southern Province in 2018 (4)."
health,"As of 2021, the estimated global number of child brides was 650 million : child marriage places girls at increased risk of pregnancy because girls who are married very early typically have limited autonomy to influence decision-making about delaying child-bearing and contraceptive use."
health,A WHO report published in 2021 estimates that 120 million girls aged under 20 years were subjected to sexual violence by someone other than a partner.
health,"However, there is growing attention being paid to improving access to and quality of maternal care for pregnant and parenting adolescents."
health,"In this evolving context, WHO continues its work across sectors to support countries to address adolescent pregnancy effectively in the context of their national programmes, and to prevent child marriage and provide care and support to married adolescents."
health,"Common conditions in older age include hearing loss, cataracts and refractive errors, back and neck pain and osteoarthritis, chronic obstructive pulmonary disease, diabetes, depression and dementia."
health,A comprehensive public health response must address this wide range of older people’s experiences and needs.
health,"Public health professionals, and society as a whole, need to address these and other ageist attitudes, which can lead to discrimination, affect the way policies are developed and the opportunities older people have to experience healthy aging."
health,A public health response must take stock of these current and projected trends and frame policies accordingly.
health,"However, countries report continued interference from the alcohol industry in policy development."
health,"Overall, the proportion of people with alcohol use disorders in contact with treatment services varies from less than 1% to no more than 14% in all countries where such data are available."
health,"Drinking alcohol is associated with risks of developing noncommunicable diseases such as liver diseases, heart diseases, and different types of cancers, as well as mental health and behavioural conditions such as depression, anxiety and alcohol use disorders."
health,A causal relationship has been established between alcohol use and the incidence or outcomes of infectious diseases such as tuberculosis and HIV.
health,"Achieving a reduction in the harmful use of alcohol in line with the targets included in the Global alcohol action plan, the SDG 2030 agenda and the WHO Global monitoring framework for noncommunicable diseases, requires concerted action by countries and effective global governance."
health,Public policies and interventions to prevent and reduce alcohol-related harm should be guided and formulated by public health interests and based on clear public health goals and the best available evidence.
health,"Engaging all relevant stakeholders is essential but the potential conflicts of interest, particularly with the alcohol industry, must be carefully assessed before engagement."
health,"Economic operators should refrain from activities that might prevent, delay or stop the development, enactment, implementation and enforcement of high-impact strategies and interventions to reduce the harmful use of alcohol."
health,"WHO estimates that in 2019, some 68% of outdoor air pollution related premature deaths were due to ischaemic heart disease and stroke, 14% were due to chronic obstructive pulmonary disease, 14% were due to acute lower respiratory infections, and 4% of deaths were due to lung cancers."
health,"Addressing air pollution, which is the second highest risk factor for noncommunicable diseases , is key to protecting public health."
health,"To read more details about these pollutants and other types, please visit this page ."
health,Cooperation with other UN agencies and non-state actors is essential and is integrated into WHO’s work to ensure synergies and maximize impact on the ground.
health,"Anaemia can be caused by poor nutrition, infections, chronic diseases, heavy menstruation, pregnancy issues and family history."
health,"The population groups most vulnerable to anaemia include children under 5 years of age, particularly infants and children under 2 years of age, menstruating adolescent girls and women, and pregnant and postpartum women."
health,"Infections can be another important cause of anaemia, depending on the local burden of infectious diseases, such as malaria, tuberculosis, HIV and parasitic infections."
health,"Consistent heavy menstrual losses, maternal blood volume expansion during pregnancy, and blood loss during and after childbirth, particularly in cases of postpartum haemorrhage, commonly lead to anaemia."
health,"Actions include: There are several ways to help prevent and manage anaemia in daily life, including eating a healthy and diverse diet and speaking to a health-care provider early if you have symptoms of anaemia."
health,"To keep a healthy and diverse diet: If you take calcium and iron supplements, take them at different times during the day."
health,People with heavy menstrual bleeding should see their doctor for treatment.
health,Doctors may recommend iron supplements or hormonal contraceptives.
health,Wash your hands with soap and water and use clean toilets to reduce the risk of infection.
health,People living in places where malaria is common should follow prevention advice from local health authorities.
health,Seek prompt treatment if you suspect you have malaria.
health,"During pregnancy, anaemia has been associated with poor maternal and birth outcomes, including premature birth, low birth weight and maternal mortality."
health,"Anaemia reduction is included as one of six World Health Assembly Global Nutrition Targets within the Comprehensive implementation plan on maternal, infant and young child nutrition ."
health,"At the Nutrition for Growth Summit in 2021, WHO committed to develop a comprehensive framework for action to prevent, diagnose and manage anaemia through a multisectoral approach."
health,"Through partnerships with community platforms, professional networks, and grassroots organizations, WHO Uganda is supporting initiatives that enhance accountability, promote people-centred care, and ensure community perspectives are embedded in policy and decision-making."
health,"Discussions highlighted the pressing need to support frontline health workers through mentorship, positive workplace environments, and mental health support."
health,"By working closely with civil society and communities, WHO is helping to ensure that health interventions are not only technically sound but also socially responsive and equitable."
health,"The agenda seeks to ensure that all people have access to quality essential health services throughout their lives, wherever and whenever they need them, without experiencing financial hardship."
health,"Representing Uganda, Honorable Grace Mary Mugasa, Minister of State in the Ministry of Public Service, emphasized the need to move beyond commitments to measurable results. “The real test is not more declarations, but whether investments translate into deployed, motivated and high-performing health workers,” she said."
health,"As Uganda reaches the midpoint of implementing its Human Resources for Health (HRH) Strategic Plan 2020–2030, the Ministry of Health, with support from WHO and partners, is taking stock of progress and identifying priorities for the next five years."
health,"Their institutional knowledge, frontline experience and sectoral expertise are helping to ensure that Uganda’s next health workforce strategy is both evidence-based and grounded in practical realities."
health,"At the center of this effort is a comprehensive “health financing cliff analysis,” a joint initiative between WHO and the Makerere University School of Public Health, conducted in close cooperation with the Ministry of Health."
health,"Alongside this analytical work, WHO is helping the Ministry of Health refocus on improving efficiency across the health sector, a strategy seen as essential for maximizing results within constrained budgets."
health,"In mid-April 2026, WHO convened high-level meetings with the Ministry of Health leadership, including the Director General of Health Services, to share updates on the financing analysis and ongoing efficiency initiatives."
health,Recommendations emerging from these engagements are expected to inform policy reforms to enhance financial resilience and ensure a smoother transition toward self-reliance.
health,"Chris, an anthropologist at WHO’s country office in Uganda, is part of the rapid response team working on the ground to curb the Ebola outbreak in Uganda."
health,"Three days earlier, Lilian presented with signs and symptoms consistent with Ebola and was transferred to Mulago hospital’s Ebola isolation unit in Kampala for diagnosis and care."
health,"Lilian has asked them to speak to the shopkeeper who she says was “pointing fingers” at her mother when she shopped yesterday. “Ebola is a disease that everyone fears,” says Henry. “If people hear that their neighbour may have Ebola, there will be stigma there."
health,"It was our role to bring Lilian back and clear up that miscommunication and reduce that fear in the community."" After the discussion, the shopkeeper expresses his gratitude to the team for taking the time to visit and explain."
health,At around 18:30 Chris gets a call and breaks into a smile.
health,"The Joint Africa CDC–WHO AFRO Continental Incident Management Support Team (IMST) will be based at the Infectious Diseases Institute at Makerere University in Kampala, Uganda, and will become fully operational from 29 June 2026."
health,The platform will support the response to the ongoing Bundibugyo virus disease outbreak affecting the Democratic Republic of the Congo and Uganda.
health,The outbreak continues to pose a significant public health challenge in the region.
health,"The Continental IMST brings together technical experts from WHO, Africa CDC and partner organizations under a unified coordination structure to support country-led outbreak response."
health,"Following the launch, the IMST will begin routine operations, including daily coordination meetings, joint planning, information management, partner engagement, emergency logistics coordination and deployment of rapid response personnel. “Pathogens do not respect borders and neither can our response."
health,"Nyenswah, Director, Pandemic Prevention, Preparedness and Response at Africa CDC."
health,"The Continental IMST complements national leadership of the outbreak response and reflects the continued collaboration between Uganda, the Democratic Republic of the Congo, WHO, Africa CDC and partners to strengthen preparedness and response across the region."
health,"Kampala, Uganda:— Health leaders from across Africa have convened in Uganda’s capital for a high-level meeting to strengthen regional preparedness and cross-border collaboration in response to the ongoing Bundibugyo Ebola outbreak affecting Uganda and the Democratic Republic of the Congo (DRC)."
health,"The three-day meeting, organized by the World Health Organization (WHO) Regional Office for Africa, the Africa Centres for Disease Control and Prevention (Africa CDC), and UK Health Security Agency, has drawn participants from 11 high-risk countries."
health,"Belizaire warned, stressing that investing in preparedness is essential not only for public health but also for economic and national security."
health,"Tolbert Nyenswah pointed to lessons from the 2014–2016 West Africa Ebola outbreak, where strong cross-border cooperation played a key role in controlling the epidemic. “Outbreak control cannot stop at national borders,” he said."
health,"In May 2026, Uganda formally closed a polio outbreak that had been detected two years earlier, marking a major public health achievement and demonstrating the power of preparedness, coordination, and rapid response."
health,"Within five days, the Ministry of Health declared an outbreak, setting in motion one of the country’s fastest and most coordinated public health responses."
health,"Only 20 percent of children had vaccination cards, and many had never received routine immunization."
health,"Two rounds of supplementary immunization campaigns were conducted in October and November 2024, using the novel oral polio vaccine type 2."
health,"Rather than treating polio and measles as separate emergencies, authorities integrated their response, delivering measles vaccines alongside polio immunization efforts."
health,A Lesson in Preparedness Uganda’s experience highlights a fundamental truth about infectious disease outbreaks: they often begin silently.
health,"Kampala— World Health Organization (WHO) Director-General Dr Tedros Adhanom Ghebreyesus has commended Uganda’s response to the ongoing Ebola outbreak while urging continued regional cooperation, sustained investment and strong community engagement to prevent further spread of the disease."
health,"Dr Tedros visited Uganda on 8 and 9 June 2026 as part of regional missions focused on the Ebola outbreak response that started in the Democratic Republic of the Congo, with spillover into Uganda."
health,"During his visit, he met with the Ugandan Head of State, His Excellency Yoweri Museveni, health officials, health workers and partners, and assessed efforts to contain the outbreak."
health,"This outbreak of Ebola disease caused by Bundibugyo virus is rare and there are currently no approved vaccines or specific treatments, but early and optimized care is lifesaving."
health,Cases are being managed at the Ebola Treatment Unit at Mulago Hospital isolation unit which was commissioned within 6 hours of outbreak declaration.
health,During his visit to the unit Dr Tedros praised the quality of clinical care being delivered by the country’s Emergency Medical Team (EMT) members.
health,"As the outbreak continues, Dr Tedros emphasized that vigilance must remain high."
health,"While commending Uganda’s efforts, Dr Tedros stressed that no country can control the outbreak alone."
health,This is Uganda’s ninth Ebola outbreak.
health,The country’s experience in responding to previous outbreaks has helped build systems that can detect and manage public health threats quickly.
health,He encouraged Uganda to start a social movement on addressing the root causes of Ebola outbreaks.
health,"They are based on revised WHO training modules (2025), aligned with the latest evidence, and integrate tools on quality of care, clinical management and support for patients and caregivers."
health,"The sessions combined theoretical and practical approaches, including case studies, simulations, facilitation exercises and supervised clinical placements in hospitals."
health,"At the end of the training courses, participating countries developed national action plans to organize domestic trainings, reinforce mentorship and clinical supervision, improve quality of care in nutrition units and accelerate the implementation of national protocols aligned with WHO recommendations."
health,"Districts should be the drivers of their own health agendas” Andrew Bakainaga, WHO District Health Management Lead This philosophy of empowerment is more than a slogan."
health,"To put this vision into practice, WHO has deployed nine regional teams across the country: specialists in health systems, disease surveillance, and monitoring and evaluation who work hand in hand with District Health Management Teams."
health,"For the first time in some regions, district health management teams are using real-time data to strategically deploy health workers, respond to early signs of disease outbreaks, and refine their planning cycles."
health,"Uganda's recent history is marked by repeated public health emergencies: COVID-19, Ebola, C holera, A nthrax, and, most recently, Mpox."
health,"As a result, districts are not only better prepared for emerging threats but also ensure that routine services continue even when emergencies strike."
health,"Thanks to the integrated screening services supported by the World Health Organization (WHO) and World Diabetes Foundation (WDF), Sarah leaves the facility with a clear understanding of her blood pressure and blood sugar levels, and a plan for managing the hypertension."
health,Uganda and Ghana are currently the only two countries globally implementing the four-year Diabetes and Cardiovascular Disease (D-CARD) Africa Project.
health,"Launched in 2024, the initiative aims to integrate non-communicable disease (NCD) screening into existing health services—including HIV, TB, and malnutrition programs—to promote a holistic and sustainable approach to patient care."
health,"Charles Oyoo, Commissioner for Non-Communicable Diseases at the Ministry of Health."
health,"Recently, WHO handed over assorted medical equipment to Uganda’s Ministry of Health under the D-CARD Africa Project, to support the country’s fight against noncommunicable diseases."
health,"This approach has greatly improved our ability to detect conditions like hypertension and diabetes early, allowing us to manage them before complications arise,” said Jovita Atuheire, a clinician at Maziba Health Centre IV, who participated in the one-week training held in May 2025."
health,"During a recent supervision visit to project-supported districts, Dr."
health,"Diabetes and hypertension continue to pose a significant public health challenge in Uganda, with many individuals unaware of their status, delaying treatment and increasing the risk of severe complications and poor treatment outcomes."
health,"Through the integration of services at chronic care clinics, the D-CARD project is helping to bridge these gaps by strengthening early detection, diagnosis and management of diabetes and hypertension, while also supporting routine screening for HIV, TB, and malnutrition."
health,WHO reaffirms its commitment to supporting the scaling up of integrated non-communicable diseases services across Uganda.
health,"Kingi emphasized that Africa must move beyond diagnosing problems to delivering solutions at scale. “We must not only diagnose the challenges, but also prescribe the solutions, and most importantly, implement them,” he said, urging African scientists to innovate on African soil."
health,"His message was clear: “Africa’s health systems must be designed, led, and owned by Africa."
health,"Jane Ruth Aceng, underscored the importance of strengthening health systems to ensure accessibility, equity, and quality, both for primary healthcare and specialized services."
health,"Delivering a keynote address, Dr Queen Dube from WHO headquarters echoed the call for a multisectoral approach. “Most causes of ill-health lie outside the health sector."
health,"Investing in Primary Health Care (PHC) by embedding services for HIV, TB, malaria, and related comorbidities into PHC and community-based services."
health,"Responding to the growing global dialogue on workplace mental health, especially during the current transition within WHO and across the broader UN community, WHO Uganda launched the ‘Men Talk’ series—a bold and timely initiative aimed at supporting the mental health and wellbeing of male colleagues."
health,"I believe fathers should share financial wisdom with their sons early on, rather than waiting until adulthood."
health,"Men need to learn how to manage their finances wisely—especially by living within their means.” To keep the momentum, a WhatsApp group exclusively for male staff has been created."
health,"Kampala ‒ In an effort to protect populations often left behind in public health campaigns, Uganda is carrying out a community-focused drive to ensure extensive mpox vaccination coverage beyond the traditional health or public service facilities."
health,"World Health Organization (WHO) in partnership with Most at Risk Populations Initiative (MARPI) Clinic Mulago are carrying out the campaign to vaccinate sex workers, lorry drivers, fisherfolk and other populations often underserved by mainstream health systems."
health,"Gavi, the Vaccine Alliance, UNICEF and the Infectious Diseases Institute provided funding, logistics and training support, while government structures ensured smooth coordination."
health,"Those two things were hard for me to handle.” Nangobi was the first contact to be admitted to the Ebola treatment centre. “Finding out you have Ebola, you are psychologically, physically, mentally gone… everything,” she says."
health,"Dr Chris Opesen, an anthropologist at WHO’s Uganda country office reassured Nangobi and told her about the survivors from the previous Ebola outbreak in 2022. “I didn’t believe him."
health,"Maswaswa, along with another 178 first responders trained by WHO and Ministry of Health, has been in the frontline of Uganda’s response to major disease outbreaks including Ebola, mpox and COVID-19."
health,WHO has supported the Government of Uganda to strengthen its mental health and psychosocial support for health emergency response.
health,"In addition, WHO helped establish survivor clinics at three regional referral hospitals and one national referral hospital, ensuring continued access to specialized care for survivors close to their communities."
