Category,English
health,"Our next question comes from Anthony Stitt with Healio; your line is open. 00:10:12 Anthony Stitt, Healio Hi thanks so much for taking my call."
health,"I'll just, as you, as you all know, none of the Americans who were involved in this outbreak became ill, and so all of those passengers were residents of other countries, and there's a coordinated effort to help understand that the illness courses of those people."
health,"Our next question, please."
health,"Although the Region of the Americas has made significant progress in achieving inclusive, accessible and equitable health systems, the COVID-19 pandemic had a profound impact on health and socioeconomic development around the world, causing enormous setbacks in the progress achieved."
health,"It is the key to strengthening the collective health security of the Region, and to ensure better preparedness for future health emergencies."
health,"For this to be possible, decision-makers must commit to investing, innovating, and implementing PHC to improve health outcomes."
health,"In the years before the pandemic, the maternal mortality ratio in the Americas had stagnated, a result of the multiple barriers to access to health and quality care that women and adolescents face in the Region."
health,"This call urges countries to take immediate action at both national and subnational levels, providing recommendations to address key structural challenges in maternal health and accelerate the reduction of maternal mortality."
health,CALL TO ACTION: ZERO PREVENTABLE MATERNAL DEATHS Strategy for accelerating maternal mortality reduction in the Region of the Americas based on Primary Health Care
health,"Moving forward with Better Care for Noncommunicable Diseases is more important than ever Millions of people across the Americas live with conditions such as hypertension, diabetes, asthma, cancer, and mental health disorders."
health,A large outbreak of Bundibugyo virus disease is taking place in the Democratic Republic of the Congo (DRC) and Uganda.
health,ECDC experts assess risks to Europe and provide guidance to help countries prevent and respond to outbreaks and public health threats.
health,The use of these vaccines should be in accordance with official recommendations.
health,"Some ways to reduce mosquito breeding sites include: During outbreaks, aerial spraying of insecticides can be used to get rid of adult mosquitoes and mitigate the spread of the disease."
health,"Ebola disease is caused by viruses belonging to the genus Orthoebolavirus , Filoviridae family."
health,"These include: The disease can also lead to haemorrhagic symptoms including bloody diarrhoea, nosebleeds, vomiting blood, internal bleeding and bruises Orthoebolaviruses are mainly found in certain wild mammal species, and transmission from animals to humans is rare."
health,"Most infections occur through direct contact with the blood, secretions, tissues, organs or other body fluids of people or animals with the infection, whether alive or dead."
health,"The virus can also spread through unprotected sexual contact with a person who has recovered from the disease, or through contact with contaminated surfaces or materials."
health,One vaccine has been authorised in the European Union to protect against the disease caused by Ebola virus ( Orthoebolavirus zairense ).
health,"However, there are no vaccines available to prevent Ebola disease caused by other types of orthoebolaviruses."
health,"To prevent contracting an infection, it is recommended to: A large outbreak of Bundibugyo virus disease is taking place in the Democratic Republic of the Congo (DRC) and Uganda."
health,ECDC guidance and resources to support national and European responses are available on a dedicated outbreak page.
health,"European hantaviruses do not spread from person to person, and no insects carry the viruses."
health,"As there is no vaccine, avoiding contact with infected material is the best way to prevent infection."
health,Wearing a face mask in situations where there is high risk of coming into contact with rodents and their droppings is advisable.
health,"In 2022, an mpox outbreak caused by monkeypox virus (MPXV) clade IIb occurred in Europe and spread globally, in which the disease was transmitted between humans, mainly through sexual contact."
health,"In August 2024, the Africa Centres for Disease Control and Prevention (Africa CDC) and the World Health Organization (WHO) declared mpox a Public Health Emergency of Continental Security and a Public Health Emergency of International Concern, respectively."
health,"The clinical manifestation of the disease include: general, febrile symptoms (fever, headache, chills, physical weakness, lymph node swelling), distinct rash (papule) on the skin and sores on the mucosa (e.g. in the mouth, nose, throat, or digestive tract), back pain and muscle aches."
health,People who are immunocompromised are at a higher risk of severe disease.
health,"MPXV is transmitted to people by close contact with infected animals or people, or by touching virus-contaminated materials."
health,Mpox can be passed from one person to another during sexual contact.
health,Vaccination against mpox provides protection against the disease.
health,This section contain situation updates on currently evolving outbreaks or public health threats and weekly summaries of all information gathered through epidemic intelligence activities regarding communicable diseases of concern to the EU.
health,It doesn’t bear thinking about. “I want to make sure everyone else my age is completing theirs when they get one – it’s so easy to do and for me it was life-changing.” England’s top cancer doctor is also urging those in their 50s to return their kits when the NHS invites them.
health,"Do the test and send it back – it could save your life.” It has never been easier to get screened, with the NHS sending around 8.7 million home-testing kits a year to people."
health,"Overall uptake was 65.2%, down slightly from 67.6% the previous year, with the report showing younger age groups were less likely to take up the offer."
health,Anyone worried about possible symptoms of bowel cancer should speak to their GP and should not wait for their next screening test.
health,"Genevieve Edwards, Chief Executive at Bowel Cancer UK, said: “If you’re in your 50s, you may now receive a screening kit through the post for the first time."
health,"Sir Jim’s warning comes as the NHS today launched a new campaign to remind staff what constitutes unlawful access, the potential impacts on patients and what the consequences could be for their career."
health,"The guidance sets out the different types of unlawful access, and makes clear that where it occurs, employers may report it to the Information Commissioner’s Office (ICO) and police – both of whom have the power to pursue a criminal prosecution – as well as to professional regulators, which can end a career."
health,"Unauthorised access to those records is not just a breach of data protection law — it is a betrayal of that trust, with real and lasting consequences for patients and their families. “Having the ability to view a record is not the same as having a legitimate need to do so."
health,"Children aged from 12-months to 11 years old who have missed one or both doses of the vaccine, will be invited as part of the NHS England’s campaign which runs until March next year."
health,"The vaccination rate for both MMR doses at age five years in England is 84.1% (Jan – March 2026), lower than the 95% target set by the World Health Organization (WHO) and in January this year the WHO confirmed that the UK had lost its measles elimination status."
health,"These illnesses can be devastating, but they are preventable through routine childhood immunisation. “If you’ve been contacted by the NHS to catch up on your child’s vaccinations, I encourage you to take up this offer as soon as possible."
health,"Making sure children are fully vaccinated means we can help keep them healthy, protect vulnerable people in our communities and prevent future outbreaks.”"
health,It then either directs them to the most appropriate service or provides clinicians with the information they need to prioritise care.
health,Patients will continue to have the option of using traditional methods to contact their GP practice alongside the new AI triage tool in the NHS App.
health,The rollout will start with hospital appointments not requiring an overnight stay where their use has been proven to significantly reduce the amount of time clinicians spent on admin.
health,"The study, led by Great Ormond Street Hospital, found that scaling the technology nationally to over 11,000 A&E clinicians in England could create space for over 9,000 extra A&E consultations each day."
health,A pilot in the emergency department at St George’s Hospital in Tooting found that it saved clinicians an average of 47 minutes per shift – allowing each member of staff to see an additional patient every shift.
health,"Other plans that are part of the £10 billion technology, digital and data investment include NHS App users being able join online appointments with expert clinicians across England using the NHS’s new virtual hospital service – NHS Online."
health,"Sir Jim said the plans will see the NHS finally end the “unacceptable” uncertainty of patients not knowing whether they’ve been referred or receiving invitations days after an appointment has already been missed – to ensure people can access specialist care faster, while improving NHS efficiency."
health,"Should patients need to reschedule their appointment at the last minute, hospitals are being asked to ensure a new appointment invitation is received within 28 days."
health,They have been published and circulated to all providers of planned NHS care today to ensure they can be put into practice as soon as possible to deliver a more consistent experience for patients across the country.
health,"All NHS trusts will now be asked to publish a summary annually of their performance towards the 8 new standards, to ensure transparency for patients and the public about how their local services are performing."
health,"While some trusts are already demonstrating significant improvements and elements of best practice in customer service, the new guidance represents the minimum expected from all providers to ensure standards are improved across the country, while delivering efficiencies and savings for the NHS."
health,"The standards comes as the NHS continues to invest in joining up fragmented health data ahead of government plans to introduce a ‘Single Patient Record’ that will enable safer, more co-ordinated care and ensure patients do not have to keep repeating their story to multiple healthcare professionals."
health,"These new patient standards are the bare minimum and things the health service should already be providing patients: clear confirmation when you’re referred, regular updates while you wait, and proper notice before your appointment."
health,"From September, all adults aged 65-74 who are living with a chronic respiratory disease and those with immunosuppression due to disease or treatment will be offered the respiratory syncytial virus (RSV) vaccine, as the NHS expands its life-saving programme to protect those who are most vulnerable."
health,"Millions of people aged 75 years and over and all residents in care homes for older adults are already able to get the RSV vaccine ahead of this winter – and since 2024, the NHS has also offered the RSV vaccine to all pregnant women, helping to protect 300,000 mothers and babies in its first year alone."
health,"Caroline Temmink, Director of Vaccination at NHS England, said : “RSV can make people seriously ill, which is why it’s so important for those who are particularly vulnerable to be protected."
health,"Expanding the vaccine to this group offers them the best possible protection and can help keep people out of hospital. “If you are aged 75 or over, or live in a care home for older adults and are yet to get vaccinated, now is the time to come forward."
health,"Although RSV spreads most in winter, this virus poses a risk all year round, so if you’ve been offered the jab, please come forward to your GP or local pharmacy."
health,"New evidence makes it clear that these two groups of patients are at the highest risk of needing hospital admission due to RSV. “The vaccine gives excellent protection against severe lung infection, and I would encourage anyone eligible to take it up when offered."
health,Almost all (93%) individuals diagnosed by the programme had no record of a prior HIV test – according to research by the UK Health Security Agency (UKHSA) – which health chiefs believe shows the initiative is reaching people who are unlikely to be tested routinely through other routes.
health,"One person whose previously unidentified HIV was found by the NHS ED Opt-Out Testing Programme is Ayo from Manchester, who is in his 50s."
health,"Ayo, said: “If I wasn’t in hospital, I wouldn’t have been tested for HIV."
health,This ED testing scheme is doing exactly that – finding hundreds of unidentified HIV cases among people who may never have otherwise sought a test. “Research supported by two of our NIHR Health Protection Research Units shows that this is a highly cost-effective intervention.
health,"This marks a critical pivot from sickness to prevention, protecting communities who need it the most.” NHS leaders are continuing to rollout the programme to help more people unknowingly living with HIV; and a further three new hospitals will start offering testing to their ED patients by April 2027."
health,"Dr Tamara Djuretic, Consultant Epidemiologist and Head of HIV Section at UKHSA, said : “NHS opt-out testing in emergency departments is helping to reach people who don’t realise they’re living with HIV or other blood-borne viruses."
health,"The continuation of opt-out HIV testing is crucial as we work to end new HIV cases in England by 2030 and ensure no one – regardless of gender, ethnicity or location – is left behind."
health,"The next step is to take the same approach to GPs in areas with a very high HIV prevalence.” For more information on HIV testing services, visit nhs.uk website ."
health,I feel incredibly blessed and lucky that I was offered to participate in the trial and that I am still here today.” The global clinical trial KEYNOTE-A18 involved 2 NHS hospitals the Royal Devon and Exeter Foundation Trust Hospital and The Royal Marsden NHS Foundation Trust.
health,"Each candidate can make a maximum of 5 applications, so application numbers do not equate to number of applicants (individual doctors)."
health,Please use the search field to look for specific words or phrases.
health,Please note: CDC experts are working scientists and may not be available for interviews at all times.
health,"Request for Comment Form E-mail Media Relations (if you have a request other than a media inquiry) Phone: (404) 639-3286 For Members of the Media: If you are a member of the media and require information or would like to request an interview, please submit this Request for Comment Form."
health,"The number of new cancer cases worldwide could rise to almost 35 million a year by 2050 unless countries take urgent action to strengthen prevention, early diagnosis and treatment, the World Health Organization (WHO) warned on Wednesday."
health,"How a smart data tool helped the Jamaica Red Cross reach the most vulnerable after Hurricane Melissa When Hurricane Melissa tore across Jamaica as a historic Category 5 storm, it left a trail of unprecedented regional devastation. In the immediate aftermath of what became the economically costliest disaster in the country, the challenges for humanitarian teams increased. In this kind of context, needs are overwhelmingly high, resources are inherently limited, and incoming field information takes time, often arriving incomplete due to blocked roads and downed communications. Humanitarian organizations risk defaulting to larger, highly visible, or easily accessible communities along the storm's direct path. To break this cycle and ensure an inclusive disaster response, the Jamaica Red Cross and the IFRC turned to data innovation, by building a Vulnerability Index Tool . Built on the ground during the response by local Red Cross teams led by Ahmad Khan, IFRC Information Management Coordinator deployed specifically to support the operation in Jamaica, this decision-making support tool completely shifted how early emergency operations were targeted, revealing hidden and unseen realities that might have otherwise gone unnoticed. Hurricane Melissa survivor Dwayne Francis recounts how he and his neighbour fought together for survival as Category 5 winds tore through their community and homes in Jamaica in November 2025. Photo: Lauren Sabin/IFRC What is the Vulnerability Index Tool? At its core, the Vulnerability Index is a dynamic decision-support mechanism designed for rapid prioritization. It works by layering two vital datasets into a single, practical map that clearly visualizes where severe vulnerability intersects with an absence of humanitarian aid. Rather than relying on guesswork, Khan integrated data from two distinct streams. Pulling primarily from physical, house-to-house assessments — specifically the Jamaica Household Impact Disaster Assessment — volunteer teams visited affected areas to document structural damage alongside critical household demographics. This involved identifying families who were coping with elderly relatives, infants, pregnancies or members living with chronic diseases or other vulnerable conditions. Through operational networks, working groups, and humanitarian clusters, the teams were also able to track exactly which partner organizations were already serving which communities and through what specific sectors, such as shelter or health. By combining these two factors, the tool stops asking merely who is vulnerable? and starts answering a much more critical emergency question: ""Who is highly vulnerable and still completely underserved?"" This allows response operations to move entirely beyond media visibility or easy road access, directing early support straight to the places where local capacities are under the greatest strain. ""What was particularly encouraging was that the communities our branches instinctively prioritized for support were the same communities identified by the index as having the highest levels of vulnerability and the greatest impact from the hurricane,"" said Leiska Powell, Emergency Services Manager at Jamaica Red Cross . ""This gave us confidence that the tool was accurately reflecting realities on the ground and validating critical response decisions, even before the full assessment process was completed."" Jamaica Red Cross volunteers distribute shelter kits, food, water, blankets, and tarpaulins to families in Forest and Golden Grove communities in Jamaica in November 2025, providing essential emergency supplies in the aftermath of Hurricane Melissa. Photo: Damien Naylor/IFRC Overcoming duplication in Cash Assistance One of the most immediate breakthroughs of this data-driven approach was seen in the implementation of Multi-Purpose Cash (MPC) and Cash and Voucher Assistance (CVA) programs. In major disasters, a critical bottleneck for cash assistance is the time-consuming process of cross-checking beneficiary lists across multiple organizations to prevent ""double-paying"" families. By using the Vulnerability Index to map out ""zero-coverage zones"" — spots of the island where no other partners had stepped foot and no cash programs existed — the Jamaica Red Cross completely bypassed this administrative hurdle. ""Because the tool showed us that no other partners were serving those specific communities, there was no need to run months of verification checks across beneficiary lists ,"" Khan explained. ""It removed a major, time-consuming step in our distribution process and allowed us to safely speed up the implementation of cash delivery when people needed it most."" Furthermore, the data allowed for precise geofencing and area-based targeting conversations. Instead of covering broad geographic assumptions based on the pathway of the hurricane, the Jamaica Red Cross focused its outreach, registration, and cash distribution heavily on underserved communities within affected parishes. Human-verified accuracy While the data tool provided the maps, the ultimate validation came from humans on the ground. During the initial weeks of testing, field teams found a staggering 97% correlation between what the tool flagged as a high-need, low-support area and the reality verified by volunteers on site. In one unforgettable instance, the tool highlighted an isolated community completely bypassed by public attention, government officials, and international actors alike. When Red Cross teams arrived to verify the data, they discovered a man whose entire house had collapsed during the hurricane. The only thing that remained was a single broken wall, laying precariously over a refrigerator, and he slept underneath it. He had received no aid and had seen no media teams; his story and his community were entirely invisible until data and local volunteer insights brought him into focus. Jamaica Red Cross teams conduct Mental Health and Psychosocial Support (MHPSS) activities at Petersfield School, Westmoreland, Jamaica, in the aftermath of Hurricane Melissa in November 2025. Photo: Noemi Monu/IFRC Future-proofing Disaster Risk Management in the Caribbean The success of the Vulnerability Index Tool has fundamentally reshaped the operational strategy for the Jamaica Red Cross. Virtually every major programmatic distribution and cash initiative implemented by the National Society since late November has been guided directly by the tool's findings. Moreover, as the operation transitions from early crisis response into the recovery phase, the framework is adapting seamlessly. By updating the indicators from immediate storm damage to markers like housing repair progress, livelihood disruptions, access to local services, and school re-openings , the Red Cross can periodically track which communities are bouncing back and which are falling behind. This ensures that longer-term recovery efforts remain equitable and evidence-based, rather than assuming that everyone rebounds at the same pace. ""Looking ahead, I see tremendous potential for expanding the use of this tool beyond a single emergency operation,"" added Powell. ""A unified tool of this nature would be transformative for the humanitarian sector,"" she continued. ""If government agencies, humanitarian organizations and NGOs are all working from the same evidence base, we can improve coordination, increase coverage and impact, enhance efficiency, and significantly reduce duplication of effort during emergencies. The benefits would extend far beyond the Jamaica Red Cross and strengthen disaster response across the country."" The methodology is already being peer-reviewed through a scientific paper submitted by Khan through popular universities, proving its viability for the wider global humanitarian network. Because the underlying principles are highly adaptable, the tool can be updated with any functional indicators to fit anything from a localized flood to a nationwide crisis. By putting data in service of equity, the Jamaica Red Cross and the IFRC have proven that technology can also restore dignity, ensure fairness, and reach those who are usually unnoticed. joe.baaklini Wed, 07/08/2026 - 08:50 Country Jamaica 08/07/2026 Disaster/crisis Data Hurricane National Societies Jamaica Red Cross Related emergency Jamaica: Hurricane Melissa"
